ObjectID *,GlobalID *,Park,Spring name,SiteCode,SiteID,DateTime,Protocol,SurveyName,VisitType,Sampled,SpringType,Spring comments,UTM zone,Datum,GPS ID,Are you using the internal camera on this device for photos?,Camera ID #,Memory Card #,Is this a sensor spring?,Was the old sensor retrieved?,Was a new sensor deployed?,Sensor type,Sensor ID,Deployment time,Notes,FlowCondition,DischargeMethod,VolDischarge_L_per_s,DischargeClass_L_per_s,ContainerVolume_mL,PercentCaptured,Discharge notes,SpringbrookType,SpringbrookLengthFlag,SpringbrookLength_m,SpringbrookWidth_m,DiscontinuousSpringbrookLengthFlag,DiscontinuousSpringbrookLength_m,Channel description,Water quality data collected?,Enter the date and time of the last calibration,Water quality instrument,pH instrument,DO instrument,SpCond instrument,Temperature instrument,Did you check the calibration at this spring?,Please describe why a calibration check was not necessary,Calibration check parameters,Select the first pH standard,First pH temperature (C),First pH reading,Select the second pH standard,Second pH temperature (C),Second pH reading,DO% temperature (C),DO% reading,Barometric pressure (mmHg),SpCond standard (uS/cm),SpCond reading (uS/cm),Calibration check notes,Water quality parameters,Why are water quality data missing?,pH reading 1,pH reading 2,pH reading 3,Temperature reading 1 (C),Temperature reading 2 (C),Temperature reading 3 (C),SpCond reading 1 (uS/cm),SpCond reading 2 (uS/cm),SpCond reading 3 (uS/cm),DO reading 1 (%),DO reading 1 (mg/L),DO reading 2 (%),DO reading 2 (mg/L),DO reading 3 (%),DO reading 3 (mg/L),Water quality notes,Flow modification,Roads,Human use,Plant management,Hiking trails,Livestock/feral,Other,Fire,Flooding,Wildlife,Other,Overall disturbance,Disturbance notes,Is there evidence of wildlife?,Vegetation present?,LifeFormList,LifeFormListWPhotos,WoodyGT4m,Woody2to4m,WoodyLT2m,Forb,Grass,Reed,Rush,Sedge,Cattail,Bryophyte,NonPlant,Mistletoe (Phoradendron sp.) present?,Vegetation notes,Invasive Plants Observed?,Invasive notes,InvasiveListInternal,InvasiveListExternal,CreationDate *,Creator *,EditDate *,Editor *,Is springbrook continuous or discontinuous?,Is discontinuous surface water length >50m or measured?,Discontinous length (m),pHWarning,TempWarning,SpCondWarning,DOPctWarning,DOMgWarning,pH flag,Temperature flag,SpCond flag,DO flag,Permanent bolt status?,CameraCardName,Shape
14,{2fe81737-824f-412c-bae6-bbd1d09db626},Lake Mead NRA,LAKE_P_HOR0042,LAKE_P_HOR0042,309,10/28/2019 17:20,MOJN DS (Published 2018),LAKE_P_HOR0042: 2019-10-28,Primary,Sampled,Rheocrene,"Spring dry, no evidence of recent discharge",Zone 11,NAD83 (Unknown),MOJN A2 (Arrow),No,36783,MOJN_03,Yes,Yes,Yes,HOBO TidbiT,361,10:37,Sensor ID 20661046,dry,Estimated,,0 L/s,<Null>,<Null>,<Null>,,Measured,0,0,<Null>,<Null>,Source emerges at base of bedrock cliff; spring brook flows down sandy wash full of baccharis and annual grasses,No - Insufficient water,<Null>,<Null>,<Null>,<Null>,<Null>,<Null>,<Null>,<Null>,<Null>,<Null>,<Null>,<Null>,<Null>,<Null>,<Null>,<Null>,<Null>,<Null>,<Null>,<Null>,<Null>,<Null>,<Null>,<Null>,<Null>,<Null>,<Null>,<Null>,<Null>,<Null>,<Null>,<Null>,<Null>,<Null>,<Null>,<Null>,<Null>,<Null>,<Null>,None,0,0,0,0,0,0,0,0,0,0,0,New green metal fence post 10m above source (from LAKE or EPMT?). Bones and carcass of fox outside buffer,Yes,Yes,"Woody <2m, Forb, Grass, Bryophyte","Woody <2m: 0496, 0497, 0498
Forb: 0489, 0490
Grass: 0487, 0488
Bryophyte: 0499, 0500",NA,NA,1,3,2,NA,NA,NA,NA,4,NA,No,"Mistletoe present in catclaw just outside buffer, thistle (photo 0495), large cottonwoods 10-100m upstream of source (photo 0504)",Yes,POMOabundant throughout wash; at least 2 large TARA ~10m upstream of source at base of cottonwood,"TARA (Tamarix ramosissima), POMO5 (Polypogon monspeliensis)","TARA (Tamarix ramosissima): 0501, 0503
POMO5 (Polypogon monspeliensis): 0485, 0486, 0491",11/25/2019 20:21,mojn_hydro,3/10/2022 21:26,mlehman@nps.gov_nps,<Null>,<Null>,<Null>,<Null>,<Null>,<Null>,<Null>,<Null>,<Null>,<Null>,<Null>,<Null>,<Null>,<Null>,Point
13,{855cd824-1023-46fd-9d5c-51fa6476b587},Lake Mead NRA,LAKE_P_SUG0011,LAKE_P_SUG0011,295,10/28/2019 21:00,MOJN DS (Published 2018),LAKE_P_SUG0011: 2019-10-28,Primary,Sampled,Rheocrene,"Spring dry, no evidence of recent flow",Zone 11,NAD83 (Unknown),MOJN A2 (Arrow),No,36783,MOJN_03,Yes,Yes,Yes,HOBO TidbiT,361,14:25,Sensor Installed with same bolt and red and white wire as recovered sensors. Sensor ID not listed on data sheet.,dry,Estimated,,0 L/s,<Null>,<Null>,<Null>,,Measured,0,0,<Null>,<Null>,<Null>,No - Insufficient water,<Null>,<Null>,<Null>,<Null>,<Null>,<Null>,,<Null>,<Null>,<Null>,<Null>,<Null>,<Null>,<Null>,<Null>,<Null>,<Null>,<Null>,<Null>,<Null>,<Null>,<Null>,<Null>,<Null>,<Null>,<Null>,<Null>,<Null>,<Null>,<Null>,<Null>,<Null>,<Null>,<Null>,<Null>,<Null>,<Null>,<Null>,<Null>,None,0,1,1,4,0,0,1,2,0,0,4,"Old, closed road runs ~15m above source; 2 visitors observed walking down wash below source (popular hike); some litter in buffer; downed veg and scouring of banks in channel",Yes,Yes,"Woody >4m, Woody 2-4m, Woody <2m, Forb","Woody >4m: 0518, 0519, 0530
Woody 2-4m: 0531, 0532, 0521, 0520
Woody <2m: 0509, 0510, 0533
Forb: 0513, 0512, 0514, 0511",1,2,3,4,NA,NA,NA,NA,NA,NA,NA,No,"Encelia farinosa also present in buffer, annual forbs and grasses in wash just outside buffer.",Yes,Schismus sp. just ~1m outside of buffer,SCHIS (Schismus spp),SCHIS (Schismus spp): 0534,11/25/2019 20:00,mojn_hydro,3/10/2022 21:26,mlehman@nps.gov_nps,<Null>,<Null>,<Null>,<Null>,<Null>,<Null>,<Null>,<Null>,<Null>,<Null>,<Null>,<Null>,<Null>,<Null>,Point
9,{941b8734-70cb-4121-a9c2-b065557c5367},Lake Mead NRA,LAKE_P_COR0023,LAKE_P_COR0023,296,10/29/2019 18:45,MOJN DS (Published 2018),LAKE_P_COR0023: 2019-10-29,Primary,Sampled,Rheocrene,<Null>,Zone 11,NAD83 (Unknown),BadElf 4181,No,36782,MOJN_02,Yes,Yes,Yes,HOBO TidbiT,305,11:45,<Null>,flowing,Estimated,,<0.1 L/s,<Null>,<Null>,"Source pool 1.5m x 1.5m, discharge continues ~100m down small channel",,>50m,<Null>,1.75,<Null>,<Null>,"Source pool emerges at base of tuffaceous cliff, flows ~100m",Yes,10/29/2019 18:45,MOJN YSI ProDSS (4651),MOJN YSI ProDSS (4651),MOJN YSI ProDSS (4651),MOJN YSI ProDSS (4651),MOJN YSI ProDSS (4651),No,Calibrated at the spring.,<Null>,<Null>,<Null>,<Null>,<Null>,<Null>,<Null>,<Null>,<Null>,<Null>,<Null>,<Null>,<Null>,"DO_percent,pH,DO_mg_per_L,SpCond,Temp",<Null>,6.97,6.97,6.97,27.5,27.5,27.5,4011,4010,4010,34.6,2.54,34.6,2.54,34.5,2.53,SpCond took a while to stabilize in spring,None,0,1,0,0,1,0,0,0,1,0,1,"PVC pipe in phragmites patch, rebar along spring brook, barbed wire exclosure fence around spring complex, old cowpies within fence (one cowpie in the buffer)",Yes,Yes,"Woody 2-4m, Woody <2m, Forb, Grass, Reed, Rush, Sedge, Cattail, Non-Plant","Woody 2-4m: 0662, 0663
Woody <2m: 0649, 0650, 0651
Forb: 0648, 0647, 0645
Grass: 0664, 0665
Reed: 0659, 0660, 0661
Rush: 0656, 0657, 0658
Sedge: 0653, 0655
Cattail: 0667, 0668, 0669
Non-Plant: 0666",NA,6,3,2,7,1,5,4,8,NA,9,No,<Null>,Yes,<Null>,WAFI (Washingtonia filifera),"WAFI (Washingtonia filifera): 0662, 0663",11/25/2019 17:00,mojn_hydro,3/10/2022 21:26,mlehman@nps.gov_nps,No Data,,<Null>,<Null>,<Null>,<Null>,<Null>,<Null>,NF,NF,NF,NF,No data,<Null>,Point
12,{6736ab10-3cd1-4fcc-bba1-863d429f8a19},Lake Mead NRA,LAKE_P_GNA0050,LAKE_P_GNA0050,307,10/29/2019 21:19,MOJN DS (Published 2018),LAKE_P_GNA0050: 2019-10-29,Primary,Sampled,Rheocrene,Spring located in densely vegetated wash just below Northshore Rd.. Source cords from last year dry; water found ~10m downstream. Placed sensor in pool but monitored original coordinates. Internal gps for iPad 2 used because arrow would not connect.,Zone 11,NAD83 (Unknown),Unknown,No,36783,MOJN_03,Yes,No,Yes,HOBO TidbiT,310,16:06,"Sensor tied to red and white wire, tied around 2 sturdy roots",standing water,Estimated,,<0.1 L/s,<Null>,<Null>,<Null>,,Measured,1,0.5,<Null>,<Null>,"3m-4m erosional cliff south bank, north bank gradual entry to channel. Wash channel total width 10m-15m. Heavily vegetated, intense bushwhacking. Approach from north bank (note: must have meant to write south bank on sheet, approach from north blocked due to vegetation.)",Yes,10/29/2019 21:19,MOJN YSI ProDSS (1790),MOJN YSI ProDSS (1790),MOJN YSI ProDSS (1790),MOJN YSI ProDSS (1790),MOJN YSI ProDSS (1790),No,Calibrated at this spring,<Null>,<Null>,<Null>,<Null>,<Null>,<Null>,<Null>,<Null>,<Null>,<Null>,<Null>,<Null>,<Null>,"pH,DO_percent,DO_mg_per_L,SpCond,Temp",<Null>,6.9,6.9,6.9,17.5,17.5,17.5,5411,5412,5412,30.5,2.65,30.2,2.63,30,2.62,DO decreasing slightly. Measurements taken in downstream pool.,None,0,0,0,0,0,0,0,0,0,0,0,Alluvial deposits; ground level is higher than appears in previous seasons photos; road above spring with culvert outside of buffer.,Yes,Yes,"Woody >4m, Woody 2-4m, Woody <2m, Forb, Reed, Sedge, Cattail","Woody >4m: 0547, 0548, 0549
Woody 2-4m: 0550, 0551, 0552, 0553
Woody <2m: 0540
Forb: 0541, 0542, 0543, 0544
Reed: 0545, 0546
Sedge: 0555
Cattail: 0554",5,4,3,6,NA,1,NA,7,2,NA,NA,No,Dense vegetation in wash,Yes,"Little ones and big ones, source pic contains tamarisk and is listed here",TARA (Tamarix ramosissima),TARA (Tamarix ramosissima): 0538,11/25/2019 19:26,mojn_hydro,3/10/2022 21:26,mlehman@nps.gov_nps,Continuous,,<Null>,<Null>,<Null>,<Null>,<Null>,<Null>,NF,NF,NF,NF,<Null>,<Null>,Point
11,{afefa44a-45b3-4147-94bf-84058f4c7f3d},Lake Mead NRA,LAKE_P_GET0066,LAKE_P_GET0066,300,10/29/2019 21:44,MOJN DS (Published 2018),LAKE_P_GET0066: 2019-10-29,Primary,Sampled,Rheocrene,"Spring flows intermittently ~30m down gypsiferous gully, halophytes present including tamarisk and iodine bush",Zone 11,NAD83 (Unknown),BadElf 4181,No,36782,MOJN_02,Yes,Yes,Yes,HOBO TidbiT,306,15:25,New sensor installed with same bolt and white wire in same location as previous deployment,flowing,Estimated,,<0.1 L/s,<Null>,<Null>,Water dripping from wall of gully just upstream from source pool,,Measured,1.75,1,<Null>,<Null>,"Small source pool emerges at the end of narrow, gypsiferous gully, water re-emerges 15m below source pool and flows continuously for 12m down the gully over short ledge.",Yes,10/29/2019 18:51,MOJN YSI ProDSS (4651),MOJN YSI ProDSS (4651),MOJN YSI ProDSS (4651),MOJN YSI ProDSS (4651),MOJN YSI ProDSS (4651),No,Calibrated recently at corral spring,<Null>,<Null>,<Null>,<Null>,<Null>,<Null>,<Null>,<Null>,<Null>,<Null>,<Null>,<Null>,<Null>,"pH,DO_percent,DO_mg_per_L,SpCond,Temp",<Null>,7.96,7.96,7.96,8.3,8.3,8.3,20243,20242,20241,107.6,11.22,107.6,11.22,107.6,11.22,"Instrument calibrated with 1413 microseiverts/cm standard. 10000 microseiverts/cm standard would have been better. DO high, likely affected by abundant algae.",None,0,0,0,0,0,0,0,1,0,0,1,Some vegetation pressed down from flooding,Yes,Yes,"Woody 2-4m, Woody <2m, Non-Plant","Woody 2-4m: 0678, 0679, 0680
Woody <2m: 0681, 0682, 0683, 0686
Non-Plant: 0684",NA,1,2,NA,NA,NA,NA,NA,NA,NA,3,No,<Null>,Yes,At least 5 individual tamarisks,TARA (Tamarix ramosissima),"TARA (Tamarix ramosissima): 0678, 0679, 0680",11/25/2019 18:49,mojn_hydro,3/10/2022 21:26,mlehman@nps.gov_nps,<Null>,<Null>,<Null>,<Null>,<Null>,<Null>,<Null>,<Null>,NF,NF,NF,NF,<Null>,<Null>,Point
18,{dac4ea9d-0c0b-4da0-9b50-b635378674b8},Lake Mead NRA,LAKE_P_DRI0002,LAKE_P_DRI0002,330,10/30/2019 16:37,MOJN DS (Published 2018),LAKE_P_DRI0002: 2019-10-30,Primary,Sampled,Rheocrene,"Dry, high winds while monitoring. Most vegetation is senesced or dormant for winter.",Zone 11,NAD83 (Unknown),BadElf 4181,No,36783,MOJN_03,Yes,Yes,Yes,HOBO TidbiT,304,9:43,Deploying with same bolt and red and black wire.,dry,Estimated,,0 L/s,<Null>,<Null>,<Null>,,Measured,0,0,<Null>,<Null>,"Channel inside small canyon. Descends 2m dryfall, then 5m flat leading to 4m dryfall, progressing to valley floor. Granite cliff walls. Dryfall extends 15m from source.",No - Insufficient water,<Null>,<Null>,<Null>,<Null>,<Null>,<Null>,<Null>,<Null>,<Null>,<Null>,<Null>,<Null>,<Null>,<Null>,<Null>,<Null>,<Null>,<Null>,<Null>,<Null>,<Null>,<Null>,<Null>,<Null>,<Null>,<Null>,<Null>,<Null>,<Null>,<Null>,<Null>,<Null>,<Null>,<Null>,<Null>,<Null>,<Null>,<Null>,<Null>,Yes - All inactive,0,1,0,0,0,0,0,1,0,0,1,"Pipe near source possibly active when wet. Pipe on dryfall rusted and inactive. Possible trail continuing upstream from source, but that could be a stream channel from surface drainage. Flood disturbance is buildup of debris on dryfall.",Yes,Yes,"Woody <2m, Forb, Grass, Bryophyte, Non-Plant","Woody <2m: 0562, 0563, 0564
Forb: 0576, 0575
Grass: 0565, 0566, 0567
Bryophyte: 0572
Non-Plant: 0570, 0571",NA,NA,2,5,1,NA,NA,NA,NA,4,3,No,"Mistletoe not in buffer, but is 10m upstream from source. Grass is unknown brome. Multiple grass species, all senesced. Multiple woody<2: cholla and multiple senesced plants.",Yes,Other senesced grass is brome-like and may be invasive.,BRRU2 (Bromus rubens),"BRRU2 (Bromus rubens): 0568, 0569",11/25/2019 21:35,mojn_hydro,3/10/2022 21:26,mlehman@nps.gov_nps,<Null>,<Null>,<Null>,<Null>,<Null>,<Null>,<Null>,<Null>,<Null>,<Null>,<Null>,<Null>,<Null>,<Null>,Point
10,{eb299768-b080-4425-89df-6f18d24ec681},Lake Mead NRA,LAKE_P_GRA0058,LAKE_P_GRA0058,315,10/30/2019 18:00,MOJN DS (Published 2018),LAKE_P_GRA0058: 2019-10-30,Primary,Sampled,Rheocrene,"Extensive spring system with a waterfall discharging into a large pool. Actual source of spring is above waterfall, but monitoring occurs in pool below waterfall.",Zone 11,NAD83 (Unknown),BadElf 4581,No,36781,MOJN_02,Yes,Yes,Yes,HOBO TidbiT,311,0:15,"New sensor deployed in same location, attached to same bolt and wire as old sensor. Sensor is very well hidden. You may have to dig through mimulus and move a rock to find it. Sensor on left bank when looking downstream.",flowing,Volumetric,,<Null>,800,7.5,"Discharge measured at waterfall; had to estimate % flow captured (on data sheet as 5-10%, averaged for Survey123 form) due to width of waterfall and the fact that it splits down the middle.",,>50m,<Null>,1.5,<Null>,<Null>,Vegetation choked channel,Yes,10/30/2019 18:00,MOJN YSI ProDSS (1790),MOJN YSI ProDSS (1790),MOJN YSI ProDSS (1790),MOJN YSI ProDSS (1790),MOJN YSI ProDSS (1790),No,Calibrated at parking for this spring,<Null>,<Null>,<Null>,<Null>,<Null>,<Null>,<Null>,<Null>,<Null>,<Null>,<Null>,<Null>,<Null>,"pH,DO_percent,DO_mg_per_L,SpCond,Temp",<Null>,8.19,8.19,8.19,11.4,11.3,11.3,795,795,795,96.1,9.9,96.1,9.91,96,9.9,<Null>,None,0,1,0,2,0,0,0,1,0,0,2,"Some litter in buffer; social trail leads to spring; old pipe downstream near parking, but not in buffer. Graffiti on canyon wall",Yes,Yes,"Woody >4m, Woody 2-4m, Woody <2m, Forb, Grass, Reed, Cattail, Bryophyte, Non-Plant","Woody >4m: 0714, 0715, 0716
Woody 2-4m: 0714, 0715, 0716
Woody <2m: 0710, 0711, 0712
Forb: 0694, 0695, 0696, 0697
Grass: 0698, 0699, 700
Reed: 0708, 0709
Cattail: 0705, 0706, 0707
Bryophyte: 0704
Non-Plant: 0701, 0702",8,4,1,2,7,5,NA,NA,6,9,3,No,"Measured spring brook to 10m, which is where you cross over the spring brook, and had to estimate vegetation for the last 10m of spring brook.",Yes,"Tamarisk present and abundant in lower section of spring, but not at source",TARA (Tamarix ramosissima),TARA (Tamarix ramosissima): ,11/25/2019 18:25,mojn_hydro,3/10/2022 21:26,mlehman@nps.gov_nps,<Null>,<Null>,<Null>,<Null>,<Null>,<Null>,<Null>,<Null>,NF,NF,NF,NF,<Null>,<Null>,Point
17,{a872863e-e9e0-456e-9bd9-74dea1c0d50c},Lake Mead NRA,LAKE_P_PIP0016,LAKE_P_PIP0016,332,10/30/2019 18:15,MOJN DS (Published 2018),LAKE_P_PIP0016: 2019-10-30,Primary,Sampled,Rheocrene,"Petroglyphs 500m downstream. Spring is dry, most riparian veg is dead/dormant. Healthier riparian veg ~10m upstream. High winds while monitoring.",Zone 11,NAD83 (Unknown),BadElf 4181,No,36783,MOJN_03,Yes,Yes,Yes,HOBO TidbiT,307,11:30,<Null>,dry,Estimated,,0 L/s,<Null>,<Null>,Dry,,Measured,0,0,<Null>,<Null>,"6m high granite cliff south bank, north bank gradual slope. 0.25m deep channel incision, 0.5 to 1m wide channel filled with sand and gravel. Abundant woody debris from nearby dead veg.",No - Insufficient water,<Null>,<Null>,<Null>,<Null>,<Null>,<Null>,<Null>,<Null>,<Null>,<Null>,<Null>,<Null>,<Null>,<Null>,<Null>,<Null>,<Null>,<Null>,<Null>,<Null>,<Null>,<Null>,<Null>,<Null>,<Null>,<Null>,<Null>,<Null>,<Null>,<Null>,<Null>,<Null>,<Null>,<Null>,<Null>,<Null>,<Null>,<Null>,<Null>,None,0,1,1,0,0,0,0,2,1,0,2,Mammal burrows near source. Unknown white marker posts. Likely tamarisk stumps due to plant management. Rusted metal debris 9.3m downstream.,Yes,Yes,"Woody >4m, Woody 2-4m, Woody <2m, Forb, Grass, Non-Plant","Woody >4m: 0597, 0598, 0599
Woody 2-4m: 0597, 0598, 0599
Woody <2m: 0587, 0588, 0589, 0590
Forb: 0584, 0585, 0586
Grass: 0591, 0592, 0586
Non-Plant: 0594",4,5,1,2,3,NA,NA,NA,NA,NA,6,Yes,"Dead cattail laying down upstream of source. Healthy honey mesquite patch upstream from source. Dead mistletoe in buffer, living mistletoe outside of buffer.",Yes,"Abundant tufts of unknown annual grass, possibly invasive",BRRU2 (Bromus rubens),"BRRU2 (Bromus rubens): 0582, 0583",11/25/2019 21:16,mojn_hydro,3/10/2022 21:26,mlehman@nps.gov_nps,<Null>,<Null>,<Null>,<Null>,<Null>,<Null>,<Null>,<Null>,<Null>,<Null>,<Null>,<Null>,<Null>,<Null>,Point
16,{144307f9-2a35-47b1-a3c3-7286c8ee5ce3},Lake Mead NRA,LAKE_P_WIL0061,LAKE_P_WIL0061,313,10/30/2019 20:02,MOJN DS (Published 2018),LAKE_P_WIL0061: 2019-10-30,Primary,Sampled,Rheocrene,Dry. No flow markers from spring. NPS rebar marker pounded into bed about 1m downstream of source. Does not appear to have flowed recently.,Zone 11,NAD83 (Unknown),BadElf 4181,No,36783,MOJN_03,Yes,Yes,Yes,HOBO TidbiT,309,13:16,New sensor attached with buried bolt in same location as retrieved sensors,dry,Estimated,,0 L/s,<Null>,<Null>,<Null>,,Measured,0,0,<Null>,<Null>,"Low gradient, amid large granite outcrops and boulders. No incision from source.",No - Insufficient water,<Null>,<Null>,<Null>,<Null>,<Null>,<Null>,<Null>,<Null>,<Null>,<Null>,<Null>,<Null>,<Null>,<Null>,<Null>,<Null>,<Null>,<Null>,<Null>,<Null>,<Null>,<Null>,<Null>,<Null>,<Null>,<Null>,<Null>,<Null>,<Null>,<Null>,<Null>,<Null>,<Null>,<Null>,<Null>,<Null>,<Null>,<Null>,<Null>,None,0,1,0,0,0,0,0,0,0,0,1,NPS tagged rebar marker stake pounded into center of wash near source. Shotgun shells.,Yes,Yes,"Woody <2m, Forb, Grass, Non-Plant","Woody <2m: 0609, 0610, 0611
Forb: 0615, 0616, 0617
Grass: 0607, 0608
Non-Plant: 0618",NA,NA,1,2,3,NA,NA,NA,NA,NA,4,No,"Unknown woody aster, yellow flower (photos 0612, 0613, 0614). Rhus sp. almost codominant with woody<2. Possible bunches of sporabolis sp. (dead)",Yes,<Null>,BRRU2 (Bromus rubens),"BRRU2 (Bromus rubens): 0607, 0608",11/25/2019 20:55,mojn_hydro,3/10/2022 21:26,mlehman@nps.gov_nps,<Null>,<Null>,<Null>,<Null>,<Null>,<Null>,<Null>,<Null>,<Null>,<Null>,<Null>,<Null>,<Null>,<Null>,Point
15,{68ea866b-0525-46d5-8f05-3e2261ec2c93},Lake Mead NRA,LAKE_P_RAT0056,LAKE_P_RAT0056,297,10/30/2019 21:25,MOJN DS (Published 2018),LAKE_P_RAT0056: 2019-10-30,Primary,Sampled,Rheocrene,Dry. Spring source under rectangular granite boulder near a cottonwood.,Zone 11,NAD83 (Unknown),BadElf 4181,No,36783,MOJN_03,Yes,Yes,Yes,HOBO TidbiT,308,14:42,New sensor bolted under granite boulder at source using existing wire.,dry,Estimated,,0 L/s,<Null>,<Null>,<Null>,,Measured,0,0,<Null>,<Null>,More sediment in channel than is seen in previous photos. Granite boulders and outcrops. Streambed changes from gravel rich upstream to solid granite downstream. About 10cm deep channel incision in gravel.,No - Insufficient water,<Null>,<Null>,<Null>,<Null>,<Null>,<Null>,<Null>,<Null>,<Null>,<Null>,<Null>,<Null>,<Null>,<Null>,<Null>,<Null>,<Null>,<Null>,<Null>,<Null>,<Null>,<Null>,<Null>,<Null>,<Null>,<Null>,<Null>,<Null>,<Null>,<Null>,<Null>,<Null>,<Null>,<Null>,<Null>,<Null>,<Null>,<Null>,<Null>,None,0,0,1,0,0,0,0,2,0,0,2,"Flattened vegetation, old tamarisk stump, channel incision with recent sand deposition outside the incision",Yes,Yes,"Woody >4m, Woody <2m, Forb, Grass, Non-Plant","Woody >4m: 0625, 0626
Woody <2m: 0627, 0628, 0629
Forb: 0635, 0636, 0637, 0638
Grass: 0630, 0631, 0632
Non-Plant: 0639",2,NA,1,4,3,NA,NA,NA,NA,NA,5,No,<Null>,Yes,<Null>,BRRU2 (Bromus rubens),"BRRU2 (Bromus rubens): 0630, 0631, 0632",11/25/2019 20:36,mojn_hydro,3/10/2022 21:26,mlehman@nps.gov_nps,<Null>,<Null>,<Null>,<Null>,<Null>,<Null>,<Null>,<Null>,<Null>,<Null>,<Null>,<Null>,<Null>,<Null>,Point
1,{ed77c029-6c83-42ec-aeab-9ad123d370d5},Death Valley NP,DEVA_P_MCD0281,DEVA_P_MCD0281,1015,11/12/2019 20:24,MOJN DS (Published 2018),DEVA_P_MCD0281: 2019-11-12,Primary,Sampled,Rheocrene,Small 0.3x0.3 pool at base of rabbitbrush; in shallow drainage ,Zone 11,NAD83 (Unknown),BadElf 4181,No,36782,MOJN_02,Yes,Yes,Yes,HOBO TidbiT,358,12:37,<Null>,standing water,Estimated,,<0.1 L/s,<Null>,<Null>,Discharge fills a small shallow depression; wet soil extends approx 10cm beyond surface water ,,Measured,0.3,0.3,<Null>,<Null>,"Spring source located in center of preexisting channel, most likely formed by surface water runoff; channel of gravel cobble, of volcanic (tuff) origin ",Yes,11/12/2019 20:24,MOJN YSI ProDSS (4651),MOJN YSI ProDSS (4651),MOJN YSI ProDSS (4651),MOJN YSI ProDSS (4651),MOJN YSI ProDSS (4651),No,Calibrated at this spring ,<Null>,<Null>,<Null>,<Null>,<Null>,<Null>,<Null>,<Null>,<Null>,<Null>,<Null>,<Null>,<Null>,"pH,DO_percent,DO_mg_per_L,Temp,SpCond",<Null>,7.16,7.16,7.15,15.7,15.2,15.1,760,760,761,14,1.14,13.5,1.11,14.1,1.17,"DO sensor fluctuating, low water level making reading difficult; temp drop may be due to shading of sun by technician ",Yes - All inactive,1,1,0,0,0,0,0,0,1,0,1,Possible digging by wildlife near source (downstream),Yes,Yes,"Woody <2m, Forb, Grass","Woody <2m: 0724, 0725, 0726
Forb: 0733, 0734
Grass: 0731, 0732",NA,NA,1,3,2,NA,NA,NA,NA,NA,NA,No,Atriplex canescens present. Red brome (BRRU2),Yes,<Null>,"BRRU2 (Bromus rubens), BRTE (Bromus tectorum), POMO5 (Polypogon monspeliensis)","BRRU2 (Bromus rubens): 0727, 0728
BRTE (Bromus tectorum): 0731, 0732
POMO5 (Polypogon monspeliensis): 0729, 0730",11/22/2019 17:36,mojn_hydro,3/10/2022 21:26,mlehman@nps.gov_nps,No Data,,<Null>,<Null>,<Null>,<Null>,<Null>,<Null>,NF,NF,NF,NF,<Null>,<Null>,Point
4,{7b6c1067-fd26-4b33-8912-e5b783c8ec07},Death Valley NP,DEVA_P_CUR0123,DEVA_P_CUR0123,999,11/12/2019 22:44,MOJN DS (Published 2018),DEVA_P_CUR0123: 2019-11-12,Primary,Sampled,Rheocrene,"Spring consists of pool with many livestock/wildlife trails. Surface water continues appx 18m downstream in trampled, muddy channel through 2-4m high rabbitbrush",Zone 11,NAD83 (Unknown),BadElf 4181,No,36782,MOJN_02,Yes,Yes,Yes,HOBO TidbiT,360,14:55,Deployed with some wire,standing water,Estimated,,<0.1 L/s,<Null>,<Null>,Slow discharge fills source pool and pockmarked channel,,Measured,18,2.1,<Null>,<Null>,Pool at source roughly 2.5m diameter circle,Yes,11/12/2019 19:13,MOJN YSI ProDSS (4651),MOJN YSI ProDSS (4651),MOJN YSI ProDSS (4651),MOJN YSI ProDSS (4651),MOJN YSI ProDSS (4651),No,Calibrated at this spring,<Null>,<Null>,<Null>,<Null>,<Null>,<Null>,<Null>,<Null>,<Null>,<Null>,<Null>,<Null>,<Null>,"pH,DO_percent,DO_mg_per_L,SpCond",<Null>,7.59,7.59,7.59,<Null>,<Null>,<Null>,600,600,600,138.1,11.41,137.7,11.34,137.5,11.33,DO levels may be high due to high number of submerged macrophytes and algae,Yes - All inactive,0,1,0,0,4,0,0,0,1,0,4,"Near a campsite, possible human use of livestock trail. probably ungulate grazing on grass within the buffer",Yes,Yes,"Woody 2-4m, Woody <2m, Forb, Grass, Non-Plant","Woody 2-4m: 741, 742, 743
Woody <2m: 741, 742, 743
Forb: 748, 749
Grass: 750, 751
Non-Plant: 740",NA,3,1,4,2,NA,NA,NA,NA,NA,5,No,unkown grass is heavily foraged,Yes,<Null>,"POMO5 (Polypogon monspeliensis), BRRU2 (Bromus rubens), BRTE (Bromus tectorum)","POMO5 (Polypogon monspeliensis): 0746, 0747
BRRU2 (Bromus rubens): 744, 745
BRTE (Bromus tectorum): 753, 754",11/22/2019 20:24,mojn_hydro,3/10/2022 21:26,mlehman@nps.gov_nps,<Null>,<Null>,<Null>,<Null>,<Null>,<Null>,<Null>,<Null>,NF,<Null>,NF,NF,<Null>,<Null>,Point
7,{25da3d46-c8e7-4a56-b6c5-5ca7b6668def},Death Valley NP,DEVA_P_NEL0651,DEVA_P_NEL0651,1011,11/13/2019 19:30,MOJN DS (Published 2018),DEVA_P_NEL0651: 2019-11-13,Primary,Sampled,Rheocrene,"Dry, source located in channel incision. Riparian bunch grass. Upstream is willow and Rosa woodsii.",Zone 11,NAD83 (Unknown),BadElf 4181,No,36782,MOJN_02,Yes,Yes,Yes,HOBO TidbiT,359,11:35,Sensor ID 20661060. New sensor deployed with same bolt and red and white wires.,dry,Estimated,,0 L/s,<Null>,<Null>,<Null>,,Measured,0,0,<Null>,<Null>,Spring located in channel formed by surface drainage. Channel lined with rhyolitic tuff cliffs. Tuff has basalt lithics. Sandy gravel and tuff boulders in channel. Large channel between cliffs is about 10m across. Incision within this channel is <1m wide and <0.5m deep.,No - Insufficient water,<Null>,<Null>,<Null>,<Null>,<Null>,<Null>,,<Null>,<Null>,<Null>,<Null>,<Null>,<Null>,<Null>,<Null>,<Null>,<Null>,<Null>,<Null>,<Null>,<Null>,<Null>,<Null>,<Null>,<Null>,<Null>,<Null>,<Null>,<Null>,<Null>,<Null>,<Null>,<Null>,<Null>,<Null>,<Null>,<Null>,<Null>,<Null>,None,0,0,0,0,0,0,0,0,0,0,0,Possible burro track in buffer,Yes,Yes,"Woody 2-4m, Woody <2m, Forb, Grass, Bryophyte, Non-Plant","Woody 2-4m: 0777, 0778
Woody <2m: 0777, 0778
Forb: 0769, 0771
Grass: 0762, 0764, 0765
Bryophyte: 0776
Non-Plant: 0779",NA,4,5,2,1,NA,NA,NA,NA,3,6,Yes,Artemisia dracunculus (possible) was determined to be less abundant than the unknown forb,Yes,Brome carpets the majority of the buffer,BRTE (Bromus tectorum),"BRTE (Bromus tectorum): 0761, 0760",11/22/2019 21:18,mojn_hydro,3/10/2022 21:26,mlehman@nps.gov_nps,No Data,,<Null>,<Null>,<Null>,<Null>,<Null>,<Null>,<Null>,<Null>,<Null>,<Null>,<Null>,<Null>,Point
5,{6c7da03f-b529-4892-8435-fd3294b67df5},Death Valley NP,DEVA_P_WAU0880,DEVA_P_WAU0880,995,11/18/2019 22:23,MOJN DS (Published 2018),DEVA_P_WAU0880: 2019-11-18,Primary,Sampled,Rheocrene,"Source emerges from an outcrop of loosely consolidated sediment. Two large (elms?) mark the source, which is surrounded by a dilapidated, compromised, burro fence. Multiple fresh bird kills at and within source.",Zone 11,NAD83 (Unknown),MOJN G3 (Garmin64),No,36782,MOJN_02,Yes,Yes,Yes,HOBO TidbiT,315,15:20,Sensor ID 20661072. New sensor deployed with same bolt and red wire as the old sensor.,standing water,Estimated,,<0.1 L/s,<Null>,<Null>,Very slow discharge filling a small pool ~0.5in deep,,Measured,1.6,0.4,<Null>,<Null>,"Source pool is elongate, emerging from outcrop at northern drainage bank. Slight incision from discharge downstream where it joins the greater drainage. Channel trampled by wildlife/burro.",Yes,11/18/2019 22:23,MOJN YSI ProDSS (4651),MOJN YSI ProDSS (4651),MOJN YSI ProDSS (4651),MOJN YSI ProDSS (4651),MOJN YSI ProDSS (4651),No,Calibrated at this spring,<Null>,<Null>,<Null>,<Null>,<Null>,<Null>,<Null>,<Null>,<Null>,<Null>,<Null>,<Null>,<Null>,"pH,DO_percent,DO_mg_per_L,SpCond,Temp",<Null>,7.11,7.11,7.11,13.9,13.8,13.8,1053,1053,1053,0.6,0.05,0.5,0.05,0.5,0.04,"DO very low, basically anoxic. Consistent with smell. Had to dig a small depression in source pool to take water quality.",Yes - All inactive,0,1,0,0,2,0,0,0,2,0,2,Source area is within compromised burro exclosure with trampling by burro/wildlife. At least two fresh bird kills contaminating source area and source itself. Scrap metal in main drainage.,Yes,Yes,"Woody >4m, Woody 2-4m, Woody <2m, Forb, Grass","Woody >4m: 0788, 0790, 0791
Woody 2-4m: 0788, 0790, 0791
Woody <2m: 0792, 0793, 0794
Forb: 0798, 0799, 0801
Grass: 0795, 0796, 0797, 0802",1,4,3,5,2,NA,NA,NA,NA,NA,NA,No,"Bunchgrass highly trampled, possible bedding site. Young elm sapling heavily browsed.",Yes,Brome dispersed through buffer,"BRTE (Bromus tectorum), BRRU2 (Bromus rubens)","BRTE (Bromus tectorum): 0803
BRRU2 (Bromus rubens): 0804",11/22/2019 20:27,mojn_hydro,3/10/2022 21:26,mlehman@nps.gov_nps,No Data,,<Null>,<Null>,<Null>,<Null>,<Null>,<Null>,NF,NF,NF,NF,<Null>,<Null>,Point
3,{d2a48ce4-b635-4fc4-b513-80c58dfb9139},Death Valley NP,DEVA_P_SIS0800,DEVA_P_SIS0800,996,11/19/2019 19:25,MOJN DS (Published 2018),DEVA_P_SIS0800: 2019-11-19,Primary,Sampled,Rheocrene,Source is located in a narrow incised channel with a mossy damp patch of soil surrounded by willow.,Zone 11,NAD83 (Unknown),MOJN G3 (Garmin64),No,36782,MOJN_02,Yes,Yes,Yes,HOBO TidbiT,313,11:35,Sensor ID 20661051. New sensor deployed with same bolt and same wire (red),wet soil only,Estimated,,<0.1 L/s,<Null>,<Null>,"Discharge wets a patch of soil and moss, 0.75m x 0.5m",,Measured,0,0,<Null>,<Null>,Channel is a narrow incised side drainage on S side of main drainage. Choked with thick willow stand.,No - Insufficient water,<Null>,<Null>,<Null>,<Null>,<Null>,<Null>,,<Null>,<Null>,<Null>,<Null>,<Null>,<Null>,<Null>,<Null>,<Null>,<Null>,<Null>,<Null>,<Null>,<Null>,<Null>,<Null>,<Null>,<Null>,<Null>,<Null>,<Null>,<Null>,<Null>,<Null>,<Null>,<Null>,<Null>,<Null>,<Null>,<Null>,<Null>,<Null>,None,0,0,0,0,0,0,0,0,0,0,0,Pristine spring with very light evidence of wildlife use,Yes,Yes,"Woody 2-4m, Woody <2m, Forb, Grass, Bryophyte, Non-Plant","Woody 2-4m: 0817, 0818
Woody <2m: 0814, 0815
Forb: 0811, 0812
Grass: 0822, 0823
Bryophyte: 0819, 0820
Non-Plant: 0821",NA,1,2,3,4,NA,NA,NA,NA,5,6,No,Rosa woodsii also present. At least 3 species of senesced annual forb present throughout buffer.,Yes,BRTE present throughout buffer,BRTE (Bromus tectorum),"BRTE (Bromus tectorum): 0822, 0823",11/22/2019 19:53,mojn_hydro,3/10/2022 21:26,mlehman@nps.gov_nps,No Data,,<Null>,<Null>,<Null>,<Null>,<Null>,<Null>,<Null>,<Null>,<Null>,<Null>,<Null>,<Null>,Point
2,{fd444a72-b993-48fe-9118-7fb4f31b84a7},Death Valley NP,DEVA_P_BOT0781,DEVA_P_BOT0781,992,11/19/2019 21:37,MOJN DS (Published 2018),DEVA_P_BOT0781: 2019-11-19,Primary,Sampled,Rheocrene,Spring has discrete source and springbrook within open tunnel through dense willow thicket kept clear likely by wildlife.,Zone 11,NAD83 (Unknown),MOJN G3 (Garmin64),No,36782,MOJN_02,Yes,No,Yes,HOBO TidbiT,317,14:24,Sensor ID 20661073,flowing,Estimated,,<0.1 L/s,<Null>,<Null>,Discharge is a steady drip from muddy channel bank. Flow is continuous for 10.9m as a steady trickling brook.,,Measured,10.9,0.4,<Null>,<Null>,"The channel is a shallow (0.25in) meandering spring brook with black, organic rich, muddy sediment.",Yes,11/19/2019 21:35,MOJN YSI ProDSS (4651),MOJN YSI ProDSS (4651),MOJN YSI ProDSS (4651),MOJN YSI ProDSS (4651),MOJN YSI ProDSS (4651),No,Recalibrated at this spring,<Null>,<Null>,<Null>,<Null>,<Null>,<Null>,<Null>,<Null>,<Null>,<Null>,<Null>,<Null>,<Null>,"pH,DO_percent,DO_mg_per_L,SpCond,Temp",<Null>,7.91,7.91,7.91,9.4,9.4,9.4,520,520,520,90.4,8.1,90.4,8.1,90.5,8.1,Had to dig small hole in channel ~4m downstream of source to have sufficient water depth,None,0,0,0,0,0,0,0,0,1,0,1,Tunnel through willow likely kept open from wildlife traveling through/using,Yes,Yes,"Woody >4m, Woody 2-4m, Woody <2m, Forb, Grass, Sedge, Bryophyte","Woody >4m: 0831, 0832
Woody 2-4m: 0834, 0835
Woody <2m: 0834, 0835
Forb: 0843, 0827
Grass: 0841, 0842
Sedge: 0838, 0839
Bryophyte: 0837",1,2,4,3,5,NA,NA,6,NA,7,NA,No,"Grass, Forbs, and sedge mostly present in source area",No,<Null>,<Null>,<Null>,11/22/2019 18:56,mojn_hydro,3/10/2022 21:26,mlehman@nps.gov_nps,No Data,,<Null>,<Null>,<Null>,<Null>,<Null>,<Null>,NF,NF,NF,NF,<Null>,<Null>,Point
8,{03ece0ee-231f-45d6-8edb-ffcca75b2f01},Death Valley NP,DEVA_P_HUM0793,DEVA_P_HUM0793,1010,11/20/2019 17:00,MOJN DS (Published 2018),DEVA_P_HUM0793: 2019-11-20,Primary,Sampled,Rheocrene,Spring source emerges on a bench on the main drainage slope. Flow continues down a gully escarpment through an opening in a dense willow stand. Appears to be an important water source for wildlife. Actively snowing.,Zone 11,NAD83 (Unknown),MOJN G3 (Garmin64),No,36782,MOJN_02,Yes,Yes,Yes,HOBO TidbiT,316,9:25,"Sensor ID 1063 on paper data sheet, assumed to be 20661063. New sensor placed at pipe and tied with red and white wire.",flowing,Volumetric,,<Null>,500,100,"Discharge is primarily from a plastic pipe, though there is a non-trivial amount of discharge emerging ~1.75m upstream from source.",,Measured,19,0.4,<Null>,<Null>,Water flows in a shallow (0.25in) channel down gully escarpment and into a tunnel of dense vegetation,Yes,11/20/2019 17:00,MOJN YSI ProDSS (4651),MOJN YSI ProDSS (4651),MOJN YSI ProDSS (4651),MOJN YSI ProDSS (4651),MOJN YSI ProDSS (4651),No,Calibrated at this location,<Null>,<Null>,<Null>,<Null>,<Null>,<Null>,<Null>,<Null>,<Null>,<Null>,<Null>,<Null>,<Null>,"pH,DO_percent,DO_mg_per_L,SpCond,Temp",<Null>,8.14,8.14,8.15,7.7,7.7,7.7,428.7,428.7,428.6,94.6,8.5,94.6,8.5,94.7,8.51,Taken in pool within channel below escarpment,Yes - One or more active,0,1,0,0,0,0,0,0,2,0,2,"Source mainly emerges from a pipe. Source area trampled by wildlife, mostly mule deer.",Yes,Yes,"Woody >4m, Woody 2-4m, Woody <2m, Forb, Sedge, Bryophyte","Woody >4m: 0862, 0864
Woody 2-4m: 0865, 0861, 0860
Woody <2m: 0853, 0854
Forb: 0858, 0859
Sedge: 0855, 0856
Bryophyte: 0857",1,4,5,2,NA,NA,NA,3,NA,6,NA,No,Mistletoe present outside of buffer,No,<Null>,<Null>,<Null>,11/22/2019 21:43,mojn_hydro,3/10/2022 21:26,mlehman@nps.gov_nps,No Data,,<Null>,<Null>,<Null>,<Null>,<Null>,<Null>,NF,NF,NF,NF,<Null>,<Null>,Point
6,{99f9f3e1-2726-4ec9-b4e1-c93105ad59fd},Death Valley NP,DEVA_P_POP0642,DEVA_P_POP0642,1000,11/20/2019 19:03,MOJN DS (Published 2018),DEVA_P_POP0642: 2019-11-20,Primary,Sampled,Rheocrene,"Spring emerges from sediment layer under thicket of live and dead willow and cottonwoods. Heavily trampled by human, burro, and wildlife.",Zone 11,NAD83 (Unknown),MOJN G3 (Garmin64),No,36782,MOJN_02,Yes,Yes,Yes,HOBO TidbiT,361,11:18,Sensor ID 1061. Assuming full sensor ID is 20661061 but 1061 is all that is written on the sheet.,flowing,Estimated,,0.1 - <1.0 L/s,<Null>,<Null>,<Null>,,>50m,<Null>,1.5,<Null>,<Null>,Spring brook flows through muddy channel over and through large cottonwoods and willow; most of channel narrow (0.5 to 1.0m) with one wide pool ~3m which is contained/formed by cottonwood trunk.,Yes,11/20/2019 17:00,MOJN YSI ProDSS (4651),MOJN YSI ProDSS (4651),MOJN YSI ProDSS (4651),MOJN YSI ProDSS (4651),MOJN YSI ProDSS (4651),Yes,<Null>,DO_percent,<Null>,<Null>,<Null>,<Null>,<Null>,<Null>,8.6,100.2,<Null>,<Null>,<Null>,"Sensor calibrated recently at Hummingbird spring. Checked DO, it was within acceptable levels, drop of over 3000ft elevation from Hummingbird Spring. Barometric pressure not recorded on data sheet.","pH,DO_percent,DO_mg_per_L,SpCond,Temp",<Null>,7.3,7.3,7.3,19.9,19.9,19.9,915,915,915,49.6,3.84,49.4,3.82,49.3,3.81,<Null>,None,0,3,0,0,3,0,0,0,3,0,3,"Tracks and trampling a mix of human, wildlife, burro, with signs of browsing on riparian plants. No hiking trail, but recreation use (picnicking), road within 5m of buffer.",Yes,Yes,"Woody >4m, Woody 2-4m, Woody <2m, Forb, Grass, Sedge, Bryophyte, Non-Plant","Woody >4m: 0871, 0873
Woody 2-4m: 0875, 0876
Woody <2m: 0877, 0878, 0879
Forb: 0883
Grass: 0882
Sedge: 0885, 0886
Bryophyte: 0880, 0881
Non-Plant: 0884",1,2,3,6,7,NA,NA,5,NA,4,8,No,"Baccharis, sedge and grass browsed by wildlife",No,<Null>,<Null>,<Null>,11/22/2019 20:54,mojn_hydro,3/10/2022 21:26,mlehman@nps.gov_nps,<Null>,<Null>,<Null>,<Null>,<Null>,<Null>,<Null>,<Null>,NF,NF,NF,NF,<Null>,<Null>,Point
23,{29d6c587-602d-44b2-b668-dc781ef3765c},Joshua Tree NP,JOTR_P_PIN0216,JOTR_P_PIN0216,77,12/3/2019 21:57,MOJN DS (Published 2018),JOTR_P_PIN0216: 2019-12-03,Primary,Sampled,Rheocrene,"Dry. Source on north bank of wash under 2m lavender bush. Channel is lined with large granite boulders and filled with coarse sand. Spring discharges into overland flow channel. No signs of flow from spring in sandy channel, but spring source under desert lavender and under boulder is damp.",Zone 11,NAD83 (Unknown),BadElf 4581,No,36782,MOJN_02,Yes,Yes,Yes,HOBO TidbiT,350,14:08,"Sensor deployed with red and white wire in same location, tied to the lavender bush",dry,Estimated,,0 L/s,<Null>,<Null>,"Soil around source damp; rain within 4 days, but source location noticeably damper than surrounding soil. ",,Measured,0,0,<Null>,<Null>,No channel emanating from spring source. Source is on the north bank of overland drainage channel. Source is under large granite boulders.,No - Insufficient water,<Null>,<Null>,<Null>,<Null>,<Null>,<Null>,,<Null>,<Null>,<Null>,<Null>,<Null>,<Null>,<Null>,<Null>,<Null>,<Null>,<Null>,<Null>,<Null>,<Null>,<Null>,<Null>,<Null>,<Null>,<Null>,<Null>,<Null>,<Null>,<Null>,<Null>,<Null>,<Null>,<Null>,<Null>,<Null>,<Null>,<Null>,<Null>,None,0,0,0,0,0,0,0,0,0,0,0,<Null>,Yes,Yes,"Woody <2m, Forb, Grass, Woody 2-4m","Woody <2m: 0723, 0724, 0725
Forb: 0726, 0727
Grass: 0728
Woody 2-4m: 0729, 0730",NA,2,1,3,4,NA,NA,NA,NA,NA,NA,No,"Most of channel is sandy and plant free. No mistletoe in buffer, but some right outside buffer in wash, on mesquites.",No,<Null>,<Null>,<Null>,12/6/2019 19:39,mojn_hydro,3/10/2022 21:26,mlehman@nps.gov_nps,<Null>,<Null>,<Null>,<Null>,<Null>,<Null>,<Null>,<Null>,<Null>,<Null>,<Null>,<Null>,<Null>,<Null>,Point
22,{e2a96059-33f9-4c3f-b12c-f0a309a1fa77},Joshua Tree NP,JOTR_P_COT0136,JOTR_P_COT0136,96,12/4/2019 0:24,MOJN DS (Published 2018),JOTR_P_COT0136: 2019-12-03,Primary,Sampled,Rheocrene,Spring dry. Emerges out of bank of wash from about 4 m above bottom of wash. Drains into wash of >4m willow (unknown). ,Zone 11,NAD83 (Unknown),MOJN G3 (Garmin64),No,36782,MOJN_02,No,<Null>,,<Null>,<Null>,<Null>,<Null>,dry,Estimated,,0 L/s,<Null>,<Null>,"Stream bank where source located dry, channel below damp probably due to recent rains (within 5 days)",,Measured,0,0,<Null>,<Null>,"Possible source hole on bank of stream at source, in crumbly granite bank; app. .25 m incision along granite outcrops. ",No - Insufficient water,<Null>,<Null>,<Null>,<Null>,<Null>,<Null>,,<Null>,<Null>,<Null>,<Null>,<Null>,<Null>,<Null>,<Null>,<Null>,<Null>,<Null>,<Null>,<Null>,<Null>,<Null>,<Null>,<Null>,<Null>,<Null>,<Null>,<Null>,<Null>,<Null>,<Null>,<Null>,<Null>,<Null>,<Null>,<Null>,<Null>,<Null>,<Null>,None,0,0,0,0,0,0,0,4,0,0,4,Flooding caused downed willows and pile up of debris within channel. ,Yes,Yes,"Woody >4m, Woody 2-4m, Woody <2m, Forb","Woody >4m: 0735, 0736
Woody 2-4m: 0742, 0744
Woody <2m: 0745, 0747
Forb: 0738, 0741",1,2,4,3,NA,NA,NA,NA,NA,NA,NA,No,Getting dark as identifying plants,No,<Null>,<Null>,<Null>,12/6/2019 19:39,mojn_hydro,3/10/2022 21:26,mlehman@nps.gov_nps,<Null>,<Null>,<Null>,<Null>,<Null>,<Null>,<Null>,<Null>,<Null>,<Null>,<Null>,<Null>,<Null>,<Null>,Point
25,{e91f3bc7-596c-47fc-bb24-7b1f7b442eca},Joshua Tree NP,JOTR_P_COT0294,JOTR_P_COT0294,80,12/4/2019 18:15,MOJN DS (Published 2018),JOTR_P_COT0294: 2019-12-04,Primary,Sampled,Rheocrene,"Spring emerges from source pool choked with algae. Flows 9.2m before submerging under granite boulder. Large granite boulders, sand, and pebbles in channel.",Zone 11,NAD83 (Unknown),BadElf 4581,No,36782,MOJN_02,Yes,Yes,Yes,HOBO TidbiT,351,10:28,Deployed in same location with red and white wire.,flowing,Estimated,,<0.1 L/s,<Null>,<Null>,"Heavy rain, very wet everywhere. Low velocity flow and lots of algae in pools",,Measured,9.2,0.5,<Null>,<Null>,"Initial source pool 1m x 1m. At 2m from source, channel is ~0.1m, entering another pool at 5.6m before submerging into gravel under boulder at 9.2m.",Yes,12/4/2019 18:15,MOJN YSI ProDSS (4651),MOJN YSI ProDSS (4651),MOJN YSI ProDSS (4651),MOJN YSI ProDSS (4651),MOJN YSI ProDSS (4651),No,Calibrated at this spring.,<Null>,<Null>,<Null>,<Null>,<Null>,<Null>,<Null>,<Null>,<Null>,<Null>,<Null>,<Null>,<Null>,"pH,DO_percent,DO_mg_per_L,SpCond,Temp",<Null>,7.05,7.04,7.04,14.7,14.7,14.7,1273,1273,1274,40.3,3.66,40.6,3.68,41,3.72,Moderate to heavy rain. Large growth of filamentous algae in source pool. Could be affecting DO,None,0,0,0,0,0,0,0,1,0,0,1,"Evidence of flood with downed and piled veg, however not recent enough for signs of scouring, and forbs and grass present within stream channel.",Yes,Yes,"Woody >4m, Woody 2-4m, Woody <2m, Forb, Grass, Sedge, Non-Plant","Woody >4m: 0769
Woody 2-4m: 0763, 0764
Woody <2m: 0770, 0771
Forb: 0767, 0768
Grass: 0760, 0761, 0762
Sedge: 0756, 0757, 0758
Non-Plant: 0759",1,3,4,6,1,NA,NA,7,NA,NA,5,No,"Fuschia in woody<2, but it may be a forb. If it is, it dominates the forbs.",Yes,One small tamarisk in spring brook. Some small tamarisk further down wash.,"PHDA4 (Phoenix dactylifera), TARA (Tamarix ramosissima)","PHDA4 (Phoenix dactylifera): 0763, 0764
TARA (Tamarix ramosissima): 0766",12/6/2019 19:52,mojn_hydro,3/10/2022 21:26,mlehman@nps.gov_nps,<Null>,<Null>,<Null>,<Null>,<Null>,<Null>,<Null>,<Null>,NF,NF,NF,NF,<Null>,<Null>,Point
24,{04eda271-6a18-4ad9-b1e4-0b02963f5934},Joshua Tree NP,JOTR_P_LOS0014,JOTR_P_LOS0014,108,12/4/2019 21:56,MOJN DS (Published 2018),JOTR_P_LOS0014: 2019-12-04,Primary,Sampled,Rheocrene,"Dry. Rain all day, no signs of flow",Zone 11,NAD83 (Unknown),MOJN G3 (Garmin64),No,36782,MOJN_02,No,<Null>,,<Null>,<Null>,<Null>,<Null>,dry,Estimated,,0 L/s,<Null>,<Null>,Wet soil is due to rain,,Measured,0,0,<Null>,<Null>,Source in middle of surface drainage channel. Sand and pebbles and granite boulders. Lots of veg.,No - Insufficient water,<Null>,<Null>,<Null>,<Null>,<Null>,<Null>,,<Null>,<Null>,<Null>,<Null>,<Null>,<Null>,<Null>,<Null>,<Null>,<Null>,<Null>,<Null>,<Null>,<Null>,<Null>,<Null>,<Null>,<Null>,<Null>,<Null>,<Null>,<Null>,<Null>,<Null>,<Null>,<Null>,<Null>,<Null>,<Null>,<Null>,<Null>,<Null>,None,0,1,0,0,0,0,0,3,0,0,3,"Next to trail, but trail outside buffer. Signs of human use: toilet paper. Exposed fresh roots along bank.",Yes,Yes,"Woody >4m, Woody 2-4m, Woody <2m, Forb, Grass, Sedge","Woody >4m: 0783
Woody 2-4m: 0775, 0776, 0778
Woody <2m: 0779, 0780
Forb: 0781, 0782
Grass: 0786, 0787, 0788
Sedge: 0784, 0785",5,4,2,6,1,NA,NA,3,NA,NA,NA,No,"Sedge may be a rush, it has pithy stems, slightly flattened stems/modified leaves.",No,<Null>,<Null>,<Null>,12/6/2019 19:52,mojn_hydro,3/10/2022 21:26,mlehman@nps.gov_nps,<Null>,<Null>,<Null>,<Null>,<Null>,<Null>,<Null>,<Null>,<Null>,<Null>,<Null>,<Null>,<Null>,<Null>,Point
21,{070e8e5d-2b64-4dc0-a964-7d360583c714},Joshua Tree NP,JOTR_P_COT0235,JOTR_P_COT0235,112,12/5/2019 15:28,MOJN DS (Published 2018),JOTR_P_COT0235: 2019-12-05,Primary,Sampled,Rheocrene,"Dry. Odd place geologically for a spring (DMG), on a high point. No riparian veg. ",Zone 11,NAD83 (Unknown),BadElf 4581,No,36782,MOJN_02,No,<Null>,,<Null>,<Null>,<Null>,<Null>,dry,Estimated,,0 L/s,<Null>,<Null>,Dry.,,Measured,0,0,<Null>,<Null>,"Source emerges from middle of existing drainage channel. Mostly granite bedrock, some sand and pebbles. Channel is about 0.1m deep and 0.2m wide at source.",No - Insufficient water,<Null>,<Null>,<Null>,<Null>,<Null>,<Null>,,<Null>,<Null>,<Null>,<Null>,<Null>,<Null>,<Null>,<Null>,<Null>,<Null>,<Null>,<Null>,<Null>,<Null>,<Null>,<Null>,<Null>,<Null>,<Null>,<Null>,<Null>,<Null>,<Null>,<Null>,<Null>,<Null>,<Null>,<Null>,<Null>,<Null>,<Null>,<Null>,None,0,0,0,0,0,0,0,0,0,0,0,<Null>,Yes,Yes,"Forb, Grass, Woody <2m","Forb: 0796, 0797
Grass: 0798, 0799
Woody <2m: 0793, 0794, 0795",NA,NA,1,3,2,NA,NA,NA,NA,NA,NA,No,Cactus growing in channel near source,No,<Null>,<Null>,<Null>,12/6/2019 19:39,mojn_hydro,3/10/2022 21:26,mlehman@nps.gov_nps,<Null>,<Null>,<Null>,<Null>,<Null>,<Null>,<Null>,<Null>,<Null>,<Null>,<Null>,<Null>,<Null>,<Null>,Point
20,{3a5874c0-f332-4548-9704-e77b6d5f3860},Joshua Tree NP,JOTR_P_CON0215,JOTR_P_CON0215,76,12/5/2019 18:54,MOJN DS (Published 2018),JOTR_P_CON0215: 2019-12-05,Primary,Sampled,Rheocrene,"Source pool (1m x 1m) full, springbrook dry. Previous day (12/4/19) heavy, day-long rain. Source pool substrate sand, and small gravels, some bedrock. ",Zone 11,NAD83 (Unknown),BadElf 4581,No,36782,MOJN_02,Yes,No,No,<Null>,<Null>,<Null>,Crew (MNM specifically) left sensor in vehicle. ,standing water,Estimated,,<0.1 L/s,<Null>,<Null>,Standing water only; recent heavy rain (12/4/19). About 5m downstream there is small puddle (1cm deep) in granite wash with small deposition of gravel. Light flow of water continues over granite for 2 m before stopping at gravel wash. ,,Measured,1,1,<Null>,<Null>,"Source pool (1m x 1m) full, springbrook dry. Previous day (12/4/19) heavy, day-long rain. Source pool substrate sand, and small gravels, some bedrock. Channel over granite bedrock for 7m with light deposition of gravel. Wash mostly gravel between 7m and 13m downstream, then gravel within narrower channel (0.5-1m wide) between boulders. ",Yes,12/5/2019 18:54,MOJN YSI ProDSS (4651),MOJN YSI ProDSS (4651),MOJN YSI ProDSS (4651),MOJN YSI ProDSS (4651),MOJN YSI ProDSS (4651),No,Calibrated at this spring,<Null>,<Null>,<Null>,<Null>,<Null>,<Null>,<Null>,<Null>,<Null>,<Null>,<Null>,<Null>,<Null>,"pH,DO_mg_per_L,DO_percent,SpCond,Temp",<Null>,6.92,6.92,6.91,11.7,11.7,11.7,1339,1339,1339,10.2,0.98,10.1,0.97,10,0.96,"Water has an oily sheen. Bad smell, anaerobic.",None,0,0,0,0,0,0,0,0,0,0,0,"Pipes in neighboring drainage, inactive",Yes,Yes,"Woody 2-4m, Woody <2m, Grass, Bryophyte, Forb","Woody 2-4m: 0806, 0807
Woody <2m: 0812, 0813, 0814
Grass: 0810, 0811
Bryophyte: 0804, 0805
Forb: 0819, 0820",NA,2,1,4,3,NA,NA,NA,NA,5,NA,No,"Possible forb, we classified as woody<2. If it is a forb it is dominant forb and nearly tied with baccharis for rank 1. Pics: 0815, 0816, 0817, 0818. ",No,<Null>,<Null>,<Null>,12/6/2019 19:39,mojn_hydro,3/10/2022 21:26,mlehman@nps.gov_nps,No Data,,<Null>,<Null>,<Null>,<Null>,<Null>,<Null>,NF,NF,NF,NF,<Null>,<Null>,Point
31,{a732827a-5e66-4541-a1d9-5e52c0c95c32},Joshua Tree NP,JOTR_P_HOR0275,JOTR_P_HOR0275,107,12/10/2019 15:00,MOJN DS (Published 2018),JOTR_P_HOR0275: 2019-12-10,Primary,Sampled,Rheocrene,"Spring source possibly moved; or various sources within horseshoe shaped depression, all dry.",Zone 11,NAD83 (Unknown),MOJN G1 (Garmin64),No,36782,MOJN_02,No,<Null>,<Null>,<Null>,<Null>,<Null>,<Null>,dry,Estimated,,0 L/s,<Null>,<Null>,"Soil is damp all around the tight canyon the spring is in, due to rain before today (3-6 days ago)",,Measured,0,0,<Null>,<Null>,"Spring source within thick, large bunchgrass. Channel progresses through dense vegetation for 10m then through lightly vegetated corridor with moss on channel banks. Incision after dense vegetation is 0.2 to 0.5m wide and 0.1 to 0.25m deep.",No - Insufficient water,<Null>,<Null>,<Null>,<Null>,<Null>,<Null>,<Null>,<Null>,<Null>,<Null>,<Null>,<Null>,<Null>,<Null>,<Null>,<Null>,<Null>,<Null>,<Null>,<Null>,<Null>,<Null>,<Null>,<Null>,<Null>,<Null>,<Null>,<Null>,<Null>,<Null>,<Null>,<Null>,<Null>,<Null>,<Null>,<Null>,<Null>,<Null>,<Null>,None,0,0,0,0,0,0,0,0,0,0,0,"Hiking trail at bottom of canyon through main wash, flattened and partially buried bunchgrass at source due to surface drainage",Yes,Yes,"Woody 2-4m, Woody <2m, Forb, Grass, Bryophyte","Woody 2-4m: 0728, 0729
Woody <2m: 0730, 0731
Forb: 0732, 0736
Grass: 0737, 0738
Bryophyte: 0724, 0725",NA,3,2,5,1,NA,NA,NA,NA,4,NA,Yes,Also juniper and Pinus monophylla right outside buffer,Yes,"BRTE at lower end of buffer, BRRU2 all throughout buffer","BRTE (Bromus tectorum), BRRU2 (Bromus rubens)","BRTE (Bromus tectorum): 0726, 0727
BRRU2 (Bromus rubens): 0722, 0723",12/13/2019 18:51,mojn_hydro,3/10/2022 21:26,mlehman@nps.gov_nps,<Null>,<Null>,<Null>,<Null>,<Null>,<Null>,<Null>,<Null>,<Null>,<Null>,<Null>,<Null>,<Null>,<Null>,Point
32,{3a0c903e-f83e-4455-ba4f-0d5ed4f980c3},Joshua Tree NP,JOTR_P_LON0148,JOTR_P_LON0148,91,12/10/2019 15:56,MOJN DS (Published 2018),JOTR_P_LON0148: 2019-12-10,Primary,Sampled,Rheocrene,"Source is dry, in thick bunchgrass. ~0.25m channel width, 0.0 to ~0.25m deep. Moss in channel bottom from 11.7m [from source] to end of buffer. Sandy soil with pebbles.",Zone 11,NAD83 (Unknown),MOJN G1 (Garmin64),No,36782,MOJN_02,No,<Null>,<Null>,<Null>,<Null>,<Null>,<Null>,dry,Estimated,,0 L/s,<Null>,<Null>,<Null>,,Measured,0,0,<Null>,<Null>,"Channel deeper at source, shallows downstream. East bank steep with bedrock and bunchgrass, West Bank gradual slope",No - Insufficient water,<Null>,<Null>,<Null>,<Null>,<Null>,<Null>,<Null>,<Null>,<Null>,<Null>,<Null>,<Null>,<Null>,<Null>,<Null>,<Null>,<Null>,<Null>,<Null>,<Null>,<Null>,<Null>,<Null>,<Null>,<Null>,<Null>,<Null>,<Null>,<Null>,<Null>,<Null>,<Null>,<Null>,<Null>,<Null>,<Null>,<Null>,<Null>,<Null>,None,0,0,0,0,0,0,0,0,0,0,0,<Null>,Yes,Yes,"Woody <2m, Forb, Grass, Bryophyte","Woody <2m: 0744, 0746
Forb: 0762, 0763
Grass: 0747, 0749
Bryophyte: 0757",NA,NA,2,4,1,NA,NA,NA,NA,3,NA,Yes,Mistletoe outside buffer in Juniperus,Yes,BRRU2 scattered in lower 10m of buffer and dominant of three invasive grasses. POMO5 possible,"BRRU2 (Bromus rubens), BRTE (Bromus tectorum), POMO5 (Polypogon monspeliensis)","BRRU2 (Bromus rubens): 0755, 0756
BRTE (Bromus tectorum): 0753
POMO5 (Polypogon monspeliensis): 0751, 0752",12/13/2019 19:12,mojn_hydro,3/10/2022 21:26,mlehman@nps.gov_nps,<Null>,<Null>,<Null>,<Null>,<Null>,<Null>,<Null>,<Null>,<Null>,<Null>,<Null>,<Null>,<Null>,<Null>,Point
33,{1e644e80-aa4a-49b3-8bf3-5aa00e8db34d},Joshua Tree NP,JOTR_P_BAD0012,JOTR_P_BAD0012,99,12/10/2019 17:49,MOJN DS (Published 2018),JOTR_P_BAD0012: 2019-12-10,Primary,Sampled,Rheocrene,"Spring source under gneiss boulder, dry. Spring brook indistinguishable from main drainage wash. Boulder at source collects rainwater in small pool, goldfinches using it as birdbath.",Zone 11,NAD83 (Unknown),MOJN G1 (Garmin64),No,36782,MOJN_02,No,<Null>,,<Null>,<Null>,<Null>,<Null>,dry,Estimated,,0 L/s,<Null>,<Null>,<Null>,,Measured,0,0,<Null>,<Null>,"Unsorted sand, pebble, cobble, boulder. Narrow and shallow incision",No - Insufficient water,<Null>,<Null>,<Null>,<Null>,<Null>,<Null>,,<Null>,<Null>,<Null>,<Null>,<Null>,<Null>,<Null>,<Null>,<Null>,<Null>,<Null>,<Null>,<Null>,<Null>,<Null>,<Null>,<Null>,<Null>,<Null>,<Null>,<Null>,<Null>,<Null>,<Null>,<Null>,<Null>,<Null>,<Null>,<Null>,<Null>,<Null>,<Null>,None,0,0,0,0,0,0,0,0,0,0,0,<Null>,Yes,Yes,"Woody 2-4m, Woody <2m, Forb, Grass","Woody 2-4m: 0774, 0775
Woody <2m: 0768, 0769
Forb: 0776, 0777
Grass: 0772, 0773",NA,2,1,4,2,NA,NA,NA,NA,NA,NA,No,"Mistletoe outside buffer. If source is in middle of wash, not under boulder, dominant form would be eriogonum inflatum (desert trumpet)",Yes,TARA ~15m downstream of source. BRRU2 scattered lightly throughout buffer.,"TARA (Tamarix ramosissima), BRRU2 (Bromus rubens)","TARA (Tamarix ramosissima): 0774, 0775
BRRU2 (Bromus rubens): 0770, 0771",12/13/2019 19:25,mojn_hydro,3/10/2022 21:26,mlehman@nps.gov_nps,No Data,,<Null>,<Null>,<Null>,<Null>,<Null>,<Null>,<Null>,<Null>,<Null>,<Null>,,<Null>,Point
28,{79618ada-bce0-44c5-8be8-dfcf497bf498},Joshua Tree NP,JOTR_P_QUE0109,JOTR_P_QUE0109,85,12/10/2019 17:50,MOJN DS (Published 2018),JOTR_P_QUE0109: 2019-12-10,Primary,Sampled,Rheocrene,"rain recently, springbrook exists as multiple discrete pools of standing water",Zone 11,NAD83 (Unknown),BadElf 4181,No,36783,MOJN_03,Yes,Yes,Yes,HOBO TidbiT,352,10:35,attached new sensor to old wire but lengthened old wire so sensor now sits in water,standing water,Estimated,,<0.1 L/s,<Null>,<Null>,discharge comes from various sources throughout wash and fills multiple discrete pools,,Measured,2.4,1.5,<Null>,<Null>,spring emerges in granite boulder filled wash w/ granite gravel and sand infill. surface water present as discontinuous discrete pools. surface water present >125m downstream. there are at least 4 similarly sized pools within the buffer.,Yes,12/10/2019 17:50,MOJN YSI ProDSS (1790),MOJN YSI ProDSS (1790),MOJN YSI ProDSS (1790),MOJN YSI ProDSS (1790),MOJN YSI ProDSS (1790),No,calibrated at this spring,<Null>,<Null>,<Null>,<Null>,<Null>,<Null>,<Null>,<Null>,<Null>,<Null>,<Null>,<Null>,<Null>,"pH,DO_percent,DO_mg_per_L,SpCond,Temp",<Null>,8.35,8.35,8.35,7.2,7.2,7.2,150.3,150.3,150.2,102.3,10.8,102.3,10.8,102.3,10.8,"pH was stable for original reading but dropped soon after, second reading is correct (second reading listed first [second reading entered into this form])",None,0,0,0,0,0,0,0,1,0,0,1,faily pristine springbrook with no evidence of tracks or wildlife use. wash must have ran recently w/ evidence for flooding appearing as sediment accumulation and erosion throughout springbrook.,Yes,Yes,"Woody <2m, Forb, Grass, Sedge, Bryophyte","Woody <2m: 0645, 0646
Forb: 0656, 0657
Grass: 0647, 0648, 0655
Sedge: 0652, 0654, 0655
Bryophyte: 0650, 0651",NA,NA,1,5,2,NA,NA,4,NA,3,NA,Yes,california fuschia also present,Yes,single TARA present ~130m downstream,"POMO5 (Polypogon monspeliensis), BRRU2 (Bromus rubens)","POMO5 (Polypogon monspeliensis): 0658
BRRU2 (Bromus rubens): 0659",12/13/2019 17:57,mojn_hydro,3/10/2022 21:26,mlehman@nps.gov_nps,<Null>,<Null>,<Null>,<Null>,<Null>,<Null>,<Null>,<Null>,NF,NF,NF,NF,<Null>,<Null>,Point
34,{7f244f61-8741-42b9-b617-a605238e1424},Joshua Tree NP,JOTR_P_BOL0226,JOTR_P_BOL0226,103,12/10/2019 19:10,MOJN DS (Published 2018),JOTR_P_BOL0226: 2019-12-10,Primary,Sampled,Rheocrene,Dry. Spring source under >4m tree (willow sp.?) or possibly emerges from rocky outcrop.,Zone 11,NAD83 (Unknown),MOJN G1 (Garmin64),No,36782,MOJN_02,No,<Null>,<Null>,<Null>,<Null>,<Null>,<Null>,dry,Estimated,,0 L/s,<Null>,<Null>,<Null>,,Measured,0,0,<Null>,<Null>,"Source enters main surface drainage at ~3m. Low amount of incision in channel. Baccharis in drainage until boulder at 11m downstream, then channel is sandy gravel with cobbles until end of buffer.",No - Insufficient water,<Null>,<Null>,<Null>,<Null>,<Null>,<Null>,<Null>,<Null>,<Null>,<Null>,<Null>,<Null>,<Null>,<Null>,<Null>,<Null>,<Null>,<Null>,<Null>,<Null>,<Null>,<Null>,<Null>,<Null>,<Null>,<Null>,<Null>,<Null>,<Null>,<Null>,<Null>,<Null>,<Null>,<Null>,<Null>,<Null>,<Null>,<Null>,<Null>,None,0,1,0,0,0,0,0,0,0,0,1,Balloons (4) collected,Yes,Yes,"Woody >4m, Woody 2-4m, Woody <2m, Forb, Grass, Sedge, Bryophyte","Woody >4m: 0787, 0788
Woody 2-4m: 0787, 0788
Woody <2m: 0785, 0786
Forb: 0790, 0791
Grass: 0785, 0796
Sedge: 0792, 0793, 0794
Bryophyte: 0789",2,7,1,6,5,NA,NA,3,NA,4,NA,No,<Null>,Yes,bRRU2 and POMO sprinkled throughout buffer,"BRRU2 (Bromus rubens), POMO5 (Polypogon monspeliensis)","BRRU2 (Bromus rubens): 0795, 0796
POMO5 (Polypogon monspeliensis): 0797, 0798",12/13/2019 19:38,mojn_hydro,3/10/2022 21:26,mlehman@nps.gov_nps,<Null>,<Null>,<Null>,<Null>,<Null>,<Null>,<Null>,<Null>,<Null>,<Null>,<Null>,<Null>,<Null>,<Null>,Point
29,{5738bc3e-e1ea-4284-9d8f-28c978787741},Joshua Tree NP,JOTR_P_COY0033,JOTR_P_COY0033,109,12/10/2019 20:15,MOJN DS (Published 2018),JOTR_P_COY0033: 2019-12-10,Primary,Sampled,Rheocrene,source wet. located in a channel filled w/ boulders so large that the majority of the buffer is within the pore space between boulders,Zone 11,NAD83 (Unknown),MOJN G4 (Garmin64),No,36783,MOJN_03,No,<Null>,,<Null>,<Null>,<Null>,<Null>,standing water,Estimated,,<0.1 L/s,<Null>,<Null>,very slow seep from bottom of large boulder wets surrounding soil. discharge fills a small depression ~8m dnstr of source,,Measured,0.7,0.3,<Null>,<Null>,very large granite boulders fill a narrow (0.5-1m) channel which meanders through the interstitial void.,Yes,12/10/2019 17:50,MOJN YSI ProDSS (1790),MOJN YSI ProDSS (1790),MOJN YSI ProDSS (1790),MOJN YSI ProDSS (1790),MOJN YSI ProDSS (1790),Yes,<Null>,DO_percent,<Null>,<Null>,<Null>,<Null>,<Null>,<Null>,10.3,105,<Null>,<Null>,<Null>,"not recalibrated, as last spring visit was on same hike w/ similar elevations. recalibrated DO.","pH,DO_percent,DO_mg_per_L,SpCond,Temp",<Null>,7.83,7.84,7.84,7.6,7.6,7.6,139.9,139.9,139.9,98.9,10.27,98.9,10.27,98.9,10.27,<Null>,None,0,1,0,0,0,0,0,1,0,0,1,"channel appears to have ran recently, with flow lineations in the sediment.",Yes,Yes,"Woody <2m, Forb, Grass, Bryophyte","Woody <2m: 0671, 0672, 0673
Forb: 0674, 0675
Grass: 0678, 0679
Bryophyte: 0676, 0677",NA,NA,1,3,4,NA,NA,NA,NA,2,NA,No,most of the buffer is within dark granite crevices w/ no vegetation.,No,<Null>,<Null>,<Null>,12/13/2019 17:57,mojn_hydro,3/10/2022 21:26,mlehman@nps.gov_nps,<Null>,<Null>,<Null>,<Null>,<Null>,<Null>,<Null>,<Null>,NF,NF,NF,NF,<Null>,<Null>,Point
35,{f9f4f845-d929-4029-b2bd-1a9aba3b5e28},Joshua Tree NP,JOTR_P_BAR0128,JOTR_P_BAR0128,87,12/10/2019 20:48,MOJN DS (Published 2018),JOTR_P_BAR0128: 2019-12-10,Primary,Sampled,Rheocrene,"Dry, source from rocky outcrop below 6m dryfall, source possibly within fault",Zone 11,NAD83 (Unknown),MOJN G1 (Garmin64),No,36782,MOJN_02,Yes,Yes,Yes,HOBO TidbiT,314,12:50,Deployed on same red wire as old sensor,dry,Estimated,,0 L/s,<Null>,<Null>,<Null>,,Measured,0,0,<Null>,<Null>,"Narrow canyon with bedrock walls. Sand, gravel, strewn with boulders. Soil rich banks support plethora of tiny unknown sprouts",No - Insufficient water,<Null>,<Null>,<Null>,<Null>,<Null>,<Null>,<Null>,<Null>,<Null>,<Null>,<Null>,<Null>,<Null>,<Null>,<Null>,<Null>,<Null>,<Null>,<Null>,<Null>,<Null>,<Null>,<Null>,<Null>,<Null>,<Null>,<Null>,<Null>,<Null>,<Null>,<Null>,<Null>,<Null>,<Null>,<Null>,<Null>,<Null>,<Null>,<Null>,None,0,0,0,0,0,0,0,0,0,1,1,Small landslide below dryfall,Yes,Yes,"Woody <2m, Forb, Grass, Bryophyte","Woody <2m: 0805, 0806
Forb: 0807, 0808, 0809
Grass: 0811
Bryophyte: 0804",NA,NA,1,2,3,NA,NA,NA,NA,4,NA,No,Many (6-8) different species of woody <2m. 2 trees (creosote and unknown) hanging from rocky outcrops but not quite in buffer.,Yes,Only 2 stems of possible Bromus sp. found ~10m downstream from source,<Null>,: 0810,12/13/2019 19:53,mojn_hydro,3/10/2022 21:26,mlehman@nps.gov_nps,<Null>,<Null>,<Null>,<Null>,<Null>,<Null>,<Null>,<Null>,<Null>,<Null>,<Null>,<Null>,<Null>,<Null>,Point
30,{51d71f8f-1cfb-4293-870a-c3bc2e2f224b},Joshua Tree NP,JOTR_P_RAT0101,JOTR_P_RAT0101,89,12/11/2019 16:45,MOJN DS (Published 2018),JOTR_P_RAT0101: 2019-12-11,Primary,Sampled,Rheocrene,water is present at original source coordinates but source located by 2016 crew has active discharge likely providing water to original source. New source is 20m upstream in cavelike slot feature. additional note: took approx 1.25 hours to hike to spring. the first 2/3 are very boulder scrambly.,Zone 11,NAD83 (Unknown),MOJN G4 (Garmin64),No,36783,MOJN_03,No,<Null>,<Null>,<Null>,<Null>,<Null>,<Null>,flowing,Estimated,,<0.1 L/s,<Null>,<Null>,"discharge seeps from fractures all along granite slot canyon, majority of discharge comes from steady dripping at a vertical fracture at the base of the slot, too narrow, cant reach to take volumetric discharge. water actively flows from one pool to the next.",,Measured,13,0.7,<Null>,<Null>,flows down straight channel through slotlike canyon covered in massive boulders creating cavelike feature. water flows continuously for ~13m then goes subsurface at dry waterfall then reemerges at a large pool below waterfall.,Yes,12/11/2019 16:45,MOJN YSI ProDSS (1790),MOJN YSI ProDSS (1790),MOJN YSI ProDSS (1790),MOJN YSI ProDSS (1790),MOJN YSI ProDSS (1790),No,calibrated at this spring,<Null>,<Null>,<Null>,<Null>,<Null>,<Null>,<Null>,<Null>,<Null>,<Null>,<Null>,<Null>,<Null>,"pH,DO_percent,DO_mg_per_L,SpCond,Temp",<Null>,8.39,8.39,8.38,9.8,9.8,9.8,198.7,198.7,198.8,97.4,9.84,97.4,9.84,97.3,9.84,pH seems high initially,None,0,0,0,0,0,0,0,1,0,0,1,plant and stick debris present and wedged into spaces between boulders likely due to flooding,Yes,No,<Null>,<Null>,<Null>,<Null>,<Null>,<Null>,<Null>,<Null>,<Null>,<Null>,<Null>,<Null>,<Null>,No,"no vegetation present at spring. source is located in slot canyon covered in massive boulders creating cavelike feature, no veg growing out of rocks.",No,<Null>,<Null>,<Null>,12/13/2019 17:57,mojn_hydro,3/10/2022 21:26,mlehman@nps.gov_nps,<Null>,<Null>,<Null>,<Null>,<Null>,<Null>,<Null>,<Null>,NF,NF,NF,NF,<Null>,<Null>,Point
36,{bb52794f-4f87-4f9f-ac04-d7b144e1f39a},Joshua Tree NP,JOTR_P_BUZ0084,JOTR_P_BUZ0084,84,12/11/2019 18:30,MOJN DS (Published 2018),JOTR_P_BUZ0084: 2019-12-11,Primary,Sampled,Rheocrene,"Spring flows around boulder down bedrock into source pool. Upper source pool ~2m long and 0.5m wide. Drains into second pool ~5.6m long, before dropping into lower pool ~10m long. Above source pool is another swampy pool ~10m long, which drains over bedrock. Small sediment substrate pool before entering official source pool. Water seeps from crack in bedrock on north side of first pools near source.",Zone 11,NAD83 (Unknown),MOJN G1 (Garmin64),No,36782,MOJN_02,No,<Null>,<Null>,<Null>,<Null>,<Null>,<Null>,flowing,Estimated,,<0.1 L/s,<Null>,<Null>,Small stream trickle over granite into source pool,,Measured,6.7,1,<Null>,<Null>,"Flows down algae rich rock into algae rich pool 6.7m long, 0.1 to 0.2m deep, then down another algae rich rock into pool ~9m long and 0.25 to 0.5m deep. Pools have sandy bottoms. Drainage is narrow granite bedrock.",Yes,12/11/2019 18:30,MOJN YSI ProDSS (4651),MOJN YSI ProDSS (4651),MOJN YSI ProDSS (4651),MOJN YSI ProDSS (4651),MOJN YSI ProDSS (4651),No,Calibrated at this spring,<Null>,<Null>,<Null>,<Null>,<Null>,<Null>,<Null>,<Null>,<Null>,<Null>,<Null>,<Null>,<Null>,"pH,DO_percent,DO_mg_per_L,SpCond,Temp",<Null>,7.83,7.83,7.83,10,10,10,1675,1675,1675,113.1,11.91,112.9,11.89,112.9,11.89,High DO possibly caused by large coverage of algae.,None,0,0,0,0,0,0,0,0,1,0,1,"Riparian veg browsing possibly by bighorn sheep, bighorn scat in source pools.",Yes,Yes,"Woody >4m, Woody <2m, Forb, Grass, Sedge, Bryophyte, Non-Plant","Woody >4m: 0830
Woody <2m: 0831, 0832
Forb: 0833
Grass: 0825, 0826
Sedge: 0827, 0828, 0829
Bryophyte: 0823
Non-Plant: 0824",2,NA,3,7,5,NA,NA,4,NA,6,1,No,Paloverde and acacia also present in buffer,No,<Null>,<Null>,<Null>,12/13/2019 20:14,mojn_hydro,3/10/2022 21:26,mlehman@nps.gov_nps,<Null>,<Null>,<Null>,<Null>,<Null>,<Null>,<Null>,<Null>,NF,NF,NF,NF,<Null>,<Null>,Point
27,{a0d5780d-2319-4863-97e4-1c630fcab8a2},Joshua Tree NP,JOTR_P_LIT0207,JOTR_P_LIT0207,105,12/11/2019 20:53,MOJN DS (Published 2018),JOTR_P_LIT0207: 2019-12-11,Primary,Sampled,Rheocrene,spring dry. source located in a small side wash branching off of the main drainage.,Zone 11,NAD83 (Unknown),BadElf 4181,No,36783,MOJN_03,No,<Null>,,<Null>,<Null>,<Null>,<Null>,dry,Estimated,,0 L/s,<Null>,<Null>,spring dry (source). damp soil elsewhere in the buffer likely due to recent rain.,,Measured,0,0,<Null>,<Null>,channel is filled with granitic sand/gravel. the source is on a bank of sediment with an exposed granite vein. no signs of recent flow.,No - Insufficient water,<Null>,<Null>,<Null>,<Null>,<Null>,<Null>,,<Null>,<Null>,<Null>,<Null>,<Null>,<Null>,<Null>,<Null>,<Null>,<Null>,<Null>,<Null>,<Null>,<Null>,<Null>,<Null>,<Null>,<Null>,<Null>,<Null>,<Null>,<Null>,<Null>,<Null>,<Null>,<Null>,<Null>,<Null>,<Null>,<Null>,<Null>,<Null>,None,0,0,0,0,0,0,0,0,0,0,0,"spring/wash is pristine, w/ no evidence of flooding/flow w/ the recent rains.",Yes,Yes,"Woody 2-4m, Woody <2m, Forb, Grass, Non-Plant","Woody 2-4m: 0692, 0693, 0694
Woody <2m: 0698, 0699, 0700
Forb: 0703, 0704
Grass: 0695, 0696, 0697
Non-Plant: 0702",NA,4,1,3,2,NA,NA,NA,NA,NA,5,Yes,<Null>,Yes,<Null>,BRRU2 (Bromus rubens),"BRRU2 (Bromus rubens): 0690, 0691",12/13/2019 17:57,mojn_hydro,3/10/2022 21:26,mlehman@nps.gov_nps,<Null>,<Null>,<Null>,<Null>,<Null>,<Null>,<Null>,<Null>,<Null>,<Null>,<Null>,<Null>,<Null>,<Null>,Point
37,{bba852ad-a465-434c-bb73-f0d5678e041a},Joshua Tree NP,JOTR_P_HAY0287,JOTR_P_HAY0287,88,12/11/2019 22:07,MOJN DS (Published 2018),JOTR_P_HAY0287: 2019-12-11,Primary,Sampled,Rheocrene,"Source dry, ambiguous location in boulder pile with bent rusty inactive pipe, between 2 lavenders.",Zone 11,NAD83 (Unknown),MOJN G1 (Garmin64),No,36782,MOJN_02,No,<Null>,<Null>,<Null>,<Null>,<Null>,<Null>,dry,Estimated,,0 L/s,<Null>,<Null>,<Null>,,Measured,0,0,<Null>,<Null>,"Boulders, both small and massive, with coarse sand and pebbles. Sand incised from recent surface drainage.",No - Insufficient water,<Null>,<Null>,<Null>,<Null>,<Null>,<Null>,<Null>,<Null>,<Null>,<Null>,<Null>,<Null>,<Null>,<Null>,<Null>,<Null>,<Null>,<Null>,<Null>,<Null>,<Null>,<Null>,<Null>,<Null>,<Null>,<Null>,<Null>,<Null>,<Null>,<Null>,<Null>,<Null>,<Null>,<Null>,<Null>,<Null>,<Null>,<Null>,<Null>,Yes - All inactive,0,0,0,0,0,0,0,0,0,0,0,"Dam, filled with sediment, ~50m downstream of source. Inactive rusty pipes present from below dam to source.",Yes,Yes,"Woody >4m, Woody <2m, Forb","Woody >4m: 0872, 0873, 0874
Woody <2m: 0870, 0871
Forb: 0857, 0867",2,NA,1,3,NA,NA,NA,NA,NA,NA,NA,No,Desert lavender nearly tied with baccharis for woody<2m,No,<Null>,<Null>,<Null>,12/13/2019 20:23,mojn_hydro,3/10/2022 21:26,mlehman@nps.gov_nps,<Null>,<Null>,<Null>,<Null>,<Null>,<Null>,<Null>,<Null>,<Null>,<Null>,<Null>,<Null>,<Null>,<Null>,Point
26,{55546fb2-fc35-48e2-bd1e-ea356203ba89},Joshua Tree NP,JOTR_P_LON0223,JOTR_P_LON0223,114,12/11/2019 22:37,MOJN DS (Published 2018),JOTR_P_LON0223: 2019-12-11,Primary,Sampled,Rheocrene,"spring is marked by a large prosopis glandulosa patch on the north side of a dry wash. spring may be hypocrene, as there is no surface expression of water (wash is likely eroded purely from surface runoff)",Zone 11,NAD83 (Unknown),BadElf 4181,No,36783,MOJN_03,No,<Null>,,<Null>,<Null>,<Null>,<Null>,wet soil only,Estimated,,<0.1 L/s,<Null>,<Null>,"there is a damp patch of soil immediately at the base of the mesquite patch, and on the bank of the wash. likely from recent (~2 days) rain.",,Measured,0,0,<Null>,<Null>,"there is no channel within the source/mesquite patch. though the source is in the N bank of a wash. the wash is shallow and sandy, transitioning to larger granite boulders at downstream end of buffer.",No - Insufficient water,<Null>,<Null>,<Null>,<Null>,<Null>,<Null>,,<Null>,<Null>,<Null>,<Null>,<Null>,<Null>,<Null>,<Null>,<Null>,<Null>,<Null>,<Null>,<Null>,<Null>,<Null>,<Null>,<Null>,<Null>,<Null>,<Null>,<Null>,<Null>,<Null>,<Null>,<Null>,<Null>,<Null>,<Null>,<Null>,<Null>,<Null>,<Null>,None,0,0,0,4,0,0,0,0,0,0,4,the wash adjacent to the source/buffer is a fairly frequently used social trail. there are abundant human tracks.,Yes,Yes,"Woody <2m, Forb, Grass","Woody <2m: 0709, 0710
Forb: 0711, 0712, 0713
Grass: 0714, 0715, 0716",NA,NA,1,2,3,NA,NA,NA,NA,NA,NA,No,atriplex canescens also present woody<2m,Yes,only a few senesced blades of BRRU2.,BRRU2 (Bromus rubens),"BRRU2 (Bromus rubens): 0714, 0715, 0716",12/13/2019 17:57,mojn_hydro,3/10/2022 21:26,mlehman@nps.gov_nps,<Null>,<Null>,<Null>,<Null>,<Null>,<Null>,<Null>,<Null>,<Null>,<Null>,<Null>,<Null>,<Null>,<Null>,Point
38,{5617a82e-9827-4426-ac52-67c21706424e},Joshua Tree NP,JOTR_P_BUC0131,JOTR_P_BUC0131,100,12/12/2019 17:42,MOJN DS (Published 2018),JOTR_P_BUC0131: 2019-12-12,Primary,Sampled,Unknown,"Dry, no obvious source. Measured spring length from boulder and desert lavender. Mound of gravel accumulated in front of source.",Zone 11,NAD83 (Unknown),MOJN G2 (Garmin64),No,36782,MOJN_02,No,<Null>,<Null>,<Null>,<Null>,<Null>,<Null>,dry,Estimated,,0 L/s,<Null>,<Null>,<Null>,,Measured,0,0,<Null>,<Null>,"Sandy wash, no obvious stream channel, mostly absent of vegetation, substrate sand and gravel to small sized cobbles, few boulders.",No - Insufficient water,<Null>,<Null>,<Null>,<Null>,<Null>,<Null>,<Null>,<Null>,<Null>,<Null>,<Null>,<Null>,<Null>,<Null>,<Null>,<Null>,<Null>,<Null>,<Null>,<Null>,<Null>,<Null>,<Null>,<Null>,<Null>,<Null>,<Null>,<Null>,<Null>,<Null>,<Null>,<Null>,<Null>,<Null>,<Null>,<Null>,<Null>,<Null>,<Null>,None,0,0,0,0,0,0,0,0,0,0,0,<Null>,Yes,Yes,"Woody 2-4m, Woody <2m, Forb","Woody 2-4m: 0881, 0880
Woody <2m: 0883, 0884
Forb: 0885, 0887, 0888",NA,1,2,3,NA,NA,NA,NA,NA,NA,NA,No,"Sparse veg, variety of lightly scattered dried forbs; also present is creosote and possibly ephedra sp., mistletoe outside buffer",No,<Null>,<Null>,<Null>,12/13/2019 20:36,mojn_hydro,3/10/2022 21:26,mlehman@nps.gov_nps,<Null>,<Null>,<Null>,<Null>,<Null>,<Null>,<Null>,<Null>,<Null>,<Null>,<Null>,<Null>,<Null>,<Null>,Point
48,{28516879-0404-46f1-9b65-07d2b7a3cbb6},Joshua Tree NP,JOTR_P_SAM0018,JOTR_P_SAM0018,98,12/16/2019 20:33,MOJN DS (Published 2018),JOTR_P_SAM0018: 2019-12-16,Primary,Sampled,Rheocrene,spring found in dry wash with damp soik at the source. recently rained ~1 week ago. patch of baccharis/mesquite marks source,Zone 11,NAD83 (Unknown),MOJN G4 (Garmin64),No,36783,MOJN_03,No,<Null>,<Null>,<Null>,<Null>,<Null>,<Null>,wet soil only,Estimated,,<0.1 L/s,<Null>,<Null>,wet patch of soil on east bank of wash ~20x20cm,,Measured,0,0,<Null>,<Null>,narrowly incised (~1.5m) wash with gneissic boulders and lithic sand/gravel infill.,No - Insufficient water,<Null>,<Null>,<Null>,<Null>,<Null>,<Null>,<Null>,<Null>,<Null>,<Null>,<Null>,<Null>,<Null>,<Null>,<Null>,<Null>,<Null>,<Null>,<Null>,<Null>,<Null>,<Null>,<Null>,<Null>,<Null>,<Null>,<Null>,<Null>,<Null>,<Null>,<Null>,<Null>,<Null>,<Null>,<Null>,<Null>,<Null>,<Null>,<Null>,None,0,1,0,0,0,0,0,0,0,0,1,"there is a social trail that comes within ~50m of the buffer, a few human tracks found within buffer, otherwise pristine. some evidence of plant management just outside buffer (cut and burned stump).",Yes,Yes,"Woody 2-4m, Woody <2m, Forb, Grass","Woody 2-4m: 0726, 0728, 0732
Woody <2m: 0724, 0725
Forb: 0722, 0723, 0733
Grass: 0720, 0721",NA,4,1,3,2,NA,NA,NA,NA,NA,NA,No,"California fuschia is a subshrub, but at this locality it dies not have a shrubby/woody growth habit, so we ID as forb.",Yes,invasive bromes grow with forb,"BRRU2 (Bromus rubens), BRTE (Bromus tectorum)","BRRU2 (Bromus rubens): 0729, 0730
BRTE (Bromus tectorum): 0720, 0721",12/19/2019 18:50,mojn_hydro,3/10/2022 21:26,mlehman@nps.gov_nps,<Null>,<Null>,<Null>,<Null>,<Null>,<Null>,<Null>,<Null>,<Null>,<Null>,<Null>,<Null>,<Null>,<Null>,Point
47,{a4340dde-e75c-4a9b-a3ae-a30d531d52e6},Joshua Tree NP,JOTR_P_WES0255,JOTR_P_WES0255,82,12/16/2019 22:05,MOJN DS (Published 2018),JOTR_P_WES0255: 2019-12-16,Primary,Sampled,Rheocrene,"spring source located in a depression where the drainage opens up. source is damp, flattened bunchgrass marking the source region",Zone 11,NAD83 (Unknown),MOJN G4 (Garmin64),No,36783,MOJN_03,Yes,Yes,Yes,HOBO TidbiT,356,14:12,new sensor deployed in same location with white wire,wet soil only,Estimated,,<0.1 L/s,<Null>,<Null>,a damp soil patch beneath baccharis shrubs may be residual moisture from recent rain. though may also be from spring discharge. banks are damp all along buffer.,,Measured,0,0,<Null>,<Null>,"channel located in a broad depression/opening within main drainage. substrate obscured by thick, flattened bunchgrass, though further downstream in the bufer, the substrate is granitic bedrock.",No - Insufficient water,<Null>,<Null>,<Null>,<Null>,<Null>,<Null>,<Null>,<Null>,<Null>,<Null>,<Null>,<Null>,<Null>,<Null>,<Null>,<Null>,<Null>,<Null>,<Null>,<Null>,<Null>,<Null>,<Null>,<Null>,<Null>,<Null>,<Null>,<Null>,<Null>,<Null>,<Null>,<Null>,<Null>,<Null>,<Null>,<Null>,<Null>,<Null>,<Null>,None,0,0,0,0,0,0,0,2,0,0,2,"only discernable disturbance us flattening of bunchgrass, likely due to surface runoff. possible wildlife contribution.",Yes,Yes,"Woody <2m, Forb, Grass, Bryophyte","Woody <2m: 0748, 0750
Forb: 0753
Grass: 0752, 0747, 0746
Bryophyte: 0743",NA,NA,2,3,1,NA,NA,NA,NA,4,NA,No,majority of bunchgrass is dormant/dead,Yes,<Null>,"BRRU2 (Bromus rubens), BRTE (Bromus tectorum)","BRRU2 (Bromus rubens): 0741, 0742
BRTE (Bromus tectorum): 0744, 0745",12/19/2019 18:37,mojn_hydro,3/10/2022 21:26,mlehman@nps.gov_nps,<Null>,<Null>,<Null>,<Null>,<Null>,<Null>,<Null>,<Null>,<Null>,<Null>,<Null>,<Null>,<Null>,<Null>,Point
46,{cf4e20c5-15b3-44a3-8712-82e641d22132},Joshua Tree NP,JOTR_P_GAR0071,JOTR_P_GAR0071,94,12/16/2019 23:54,MOJN DS (Published 2018),JOTR_P_GAR0071: 2019-12-16,Primary,Sampled,Rheocrene,"spring source located in dense willow thicket. source is damp, though there has been recent rain. willow is thick throughout buffer.",Zone 11,NAD83 (Unknown),MOJN G4 (Garmin64),No,36783,MOJN_03,No,<Null>,<Null>,<Null>,<Null>,<Null>,<Null>,wet soil only,Estimated,,<0.1 L/s,<Null>,<Null>,"soil is damp throughout channel and buffer. may be discharge, though the channel is very shaded.",,Measured,0,0,<Null>,<Null>,shallow straight drainage with a substrate of biotic soil and willow litter,No - Insufficient water,<Null>,<Null>,<Null>,<Null>,<Null>,<Null>,<Null>,<Null>,<Null>,<Null>,<Null>,<Null>,<Null>,<Null>,<Null>,<Null>,<Null>,<Null>,<Null>,<Null>,<Null>,<Null>,<Null>,<Null>,<Null>,<Null>,<Null>,<Null>,<Null>,<Null>,<Null>,<Null>,<Null>,<Null>,<Null>,<Null>,<Null>,<Null>,<Null>,None,0,0,0,0,0,0,0,0,0,0,0,pristine buffer with no signs of disturbance.  about 60m downstream of the source are two large male ram skulls.,Yes,Yes,"Woody >4m, Woody 2-4m, Woody <2m","Woody >4m: 0758, 0759
Woody 2-4m: 0758, 0759
Woody <2m: 0762, 0763",2,1,3,NA,NA,NA,NA,NA,NA,NA,NA,No,nearly a monoculture of willow throughout buffer,Yes,one single living tamarisk (>4m),TARA (Tamarix ramosissima),"TARA (Tamarix ramosissima): 0766, 0764",12/19/2019 18:23,mojn_hydro,3/10/2022 21:26,mlehman@nps.gov_nps,<Null>,<Null>,<Null>,<Null>,<Null>,<Null>,<Null>,<Null>,<Null>,<Null>,<Null>,<Null>,<Null>,<Null>,Point
45,{d8aa9f46-e82b-48d2-936f-502599dfe3c6},Joshua Tree NP,JOTR_P_WES0155,JOTR_P_WES0155,110,12/17/2019 16:42,MOJN DS (Published 2018),JOTR_P_WES0155: 2019-12-17,Primary,Sampled,Rheocrene,"source coordinates dry. found water in a pool, and wet, mossy, seeping banks ~80m downstream of the source (also found in 2016). monitoring discharging water source as the new ""true"" source.",Zone 11,NAD83 (Unknown),MOJN G4 (Garmin64),No,36783,MOJN_03,No,<Null>,<Null>,<Null>,<Null>,<Null>,<Null>,standing water,Estimated,,<0.1 L/s,<Null>,<Null>,"discharge wets fractures in granite and mossy channel banks. fills a source pool with thick algae, suggesting persistent water",,Measured,0.5,0.5,<Null>,<Null>,"source emerges at end of dense riparian veg (baccharis, willow, old cattail) at a large granite boulder. channel continues meandering downstream (dry) with dead grass, rush, and granitic sand infill. significant mineralization and streaking on granite boulder below pool (pics 0792, 0793)",Yes,12/17/2019 16:42,MOJN YSI ProDSS (1790),MOJN YSI ProDSS (1790),MOJN YSI ProDSS (1790),MOJN YSI ProDSS (1790),MOJN YSI ProDSS (1790),No,calibrated at this spring,<Null>,<Null>,<Null>,<Null>,<Null>,<Null>,<Null>,<Null>,<Null>,<Null>,<Null>,<Null>,<Null>,"pH,DO_percent,DO_mg_per_L,SpCond,Temp",<Null>,7.09,7.09,7.09,8.9,8.9,8.9,1148,1147,1147,78.9,8.03,78.8,8.02,78.8,8.02,"SpCond std was frozen, waited for thaw before calibration. initial reading taken in dense algae and shade. sun later warmed the pool and second reading was taken in clear water (second reading entered on this form)",None,0,0,0,0,0,0,0,0,0,0,0,no disturbance at site,Yes,Yes,"Woody >4m, Woody 2-4m, Woody <2m, Forb, Grass, Sedge, Bryophyte, Non-Plant","Woody >4m: 0775, 0776
Woody 2-4m: 0788, 0789, 0790
Woody <2m: 0772, 0773, 0774
Forb: 0777, 0778
Grass: 0787
Sedge: 0779, 0785, 0786
Bryophyte: 0791
Non-Plant: 0767",4,5,1,6,2,NA,NA,3,NA,7,8,No,"dense riparian veg just upstream of source, with willow, baccharis, and cattail",Yes,<Null>,"BRRU2 (Bromus rubens), BRTE (Bromus tectorum), POMO5 (Polypogon monspeliensis)","BRRU2 (Bromus rubens): 0787
BRTE (Bromus tectorum): 0782, 0783, 0784
POMO5 (Polypogon monspeliensis): 0780, 0781",12/19/2019 18:07,mojn_hydro,3/10/2022 21:26,mlehman@nps.gov_nps,<Null>,<Null>,<Null>,<Null>,<Null>,<Null>,<Null>,<Null>,NF,NF,NF,NF,<Null>,<Null>,Point
44,{299eb9d5-2213-409b-844e-e2235897e822},Joshua Tree NP,JOTR_P_PET0260,JOTR_P_PET0260,78,12/17/2019 21:13,MOJN DS (Published 2018),JOTR_P_PET0260: 2019-12-17,Primary,Sampled,Rheocrene,source marked by a wet leafy depression amidst a dry granite sand/gravel/boulder wash.,Zone 11,NAD83 (Unknown),MOJN G4 (Garmin64),No,36783,MOJN_03,Yes,Yes,Yes,HOBO TidbiT,357,13:20,"reused same bolt and wire (2 white) for new sensor, as they were rock solid.",wet soil only,Estimated,,<0.1 L/s,<Null>,<Null>,discharge wets a patch of leaves and soil ~0.5x0.5m,,Measured,0,0,<Null>,<Null>,"source emerges in a wet depression in a very shallow wash filled with granite boulders, gravel, and sand.",No - Insufficient water,<Null>,<Null>,<Null>,<Null>,<Null>,<Null>,<Null>,<Null>,<Null>,<Null>,<Null>,<Null>,<Null>,<Null>,<Null>,<Null>,<Null>,<Null>,<Null>,<Null>,<Null>,<Null>,<Null>,<Null>,<Null>,<Null>,<Null>,<Null>,<Null>,<Null>,<Null>,<Null>,<Null>,<Null>,<Null>,<Null>,<Null>,<Null>,<Null>,None,0,1,0,0,0,0,0,0,0,0,1,a few human tracks within buffer,Yes,Yes,"Woody <2m, Forb, Grass, Bryophyte, Non-Plant","Woody <2m: 0801, 0802
Forb: 0804, 0805, 0808
Grass: 0806, 0807
Bryophyte: 0800, 0809
Non-Plant: 0799",NA,NA,1,5,2,NA,NA,NA,NA,3,4,No,"forb is perennial, though we could not find and persistant woody growth. has a pungent mint/sage aroma.",Yes,BRRU2 exists as tall (~3dm) stalks of grass with most seed gone,"BRRU2 (Bromus rubens), BRTE (Bromus tectorum)","BRRU2 (Bromus rubens): 0806, 0807
BRTE (Bromus tectorum): 0803, 0810",12/19/2019 17:40,mojn_hydro,3/10/2022 21:26,mlehman@nps.gov_nps,<Null>,<Null>,<Null>,<Null>,<Null>,<Null>,<Null>,<Null>,<Null>,<Null>,<Null>,<Null>,<Null>,<Null>,Point
40,{2a53f684-0109-4be4-9dc3-6c95bc67121a},Joshua Tree NP,JOTR_P_EAS0160,JOTR_P_EAS0160,83,12/17/2019 21:30,MOJN DS (Published 2018),JOTR_P_EAS0160: 2019-12-17,Primary,Sampled,Rheocrene,"Very large boulder over original source has shifted down since last annual visit, blocking off access to original source and old sensor; small pool in wash just below original source will be new source; fresh bighorn scat beside pool",Zone 11,NAD83 (Unknown),MOJN G1 (Garmin64),No,36782,MOJN_02,Yes,No,Yes,HOBO TidbiT,353,14:20,SN 20661024; bolt installed in sand and rocks on upstream side of source pool; sensor hanging down into pool on ~18 in of red and white wire,standing water,Estimated,,<0.1 L/s,<Null>,<Null>,<Null>,,Measured,1.8,0.5,<Null>,<Null>,Small pool nestled in sandy wash bottom amongst boulders,Yes,12/17/2019 16:15,MOJN YSI ProDSS (4651),MOJN YSI ProDSS (4651),MOJN YSI ProDSS (4651),MOJN YSI ProDSS (4651),MOJN YSI ProDSS (4651),No,Calibrated earlier in the day at vehicle,<Null>,<Null>,<Null>,<Null>,<Null>,<Null>,<Null>,<Null>,<Null>,<Null>,<Null>,<Null>,<Null>,"pH,DO_percent,DO_mg_per_L,SpCond,Temp",<Null>,6.79,6.79,6.79,6.6,6.6,6.6,176.7,176.7,176.7,85.1,9.47,85.1,9.47,85.1,9.47,Green algae in pool,None,0,0,0,0,0,0,0,2,0,1,2,"Very large boulders shifted at spring, possibly from flooding; vegetation pressed down from flooding throughout wash",Yes,Yes,"Woody <2m, Non-Plant","Woody <2m: 0890, 0891
Non-Plant: 0907",NA,NA,1,NA,NA,NA,NA,NA,NA,NA,2,No,Mistletoe present on large shrubs outside buffer; other unknown shrubs in buffer and nearby,No,<Null>,<Null>,<Null>,12/19/2019 1:58,mojn_hydro,3/10/2022 21:26,mlehman@nps.gov_nps,No Data,,<Null>,<Null>,<Null>,<Null>,<Null>,<Null>,NF,NF,NF,NF,<Null>,<Null>,Point
43,{697ab440-4fc8-4082-beac-6dc533cd023b},Joshua Tree NP,JOTR_P_NOR0083,JOTR_P_NOR0083,81,12/17/2019 23:09,MOJN DS (Published 2018),JOTR_P_NOR0083: 2019-12-17,Primary,Sampled,Rheocrene,"source is dry, though there is a small patch of damp soil (~10x10cm) ~1.5m downstream. likely discharge, as surrounding depressions are dry.",Zone 11,NAD83 (Unknown),MOJN G4 (Garmin64),No,36783,MOJN_03,Yes,Yes,Yes,HOBO TidbiT,355,15:17,new sensor deployed ~1m downstream from source with red and white wire on a damp patch of soil likely due to discharge.,wet soil only,Estimated,,<0.1 L/s,<Null>,<Null>,"wet patch of soil ~10cmx10cm, 1m downstream from source. likely due to discharge as surrounding depressions are dry. more damp soil ~17m downstream from source.",,Measured,0,0,<Null>,<Null>,"channel is drainage carved into granite bedrock, with fractures filled with sand that run parallel to the drainage.",No - Insufficient water,<Null>,<Null>,<Null>,<Null>,<Null>,<Null>,<Null>,<Null>,<Null>,<Null>,<Null>,<Null>,<Null>,<Null>,<Null>,<Null>,<Null>,<Null>,<Null>,<Null>,<Null>,<Null>,<Null>,<Null>,<Null>,<Null>,<Null>,<Null>,<Null>,<Null>,<Null>,<Null>,<Null>,<Null>,<Null>,<Null>,<Null>,<Null>,<Null>,None,0,1,0,0,0,0,0,0,0,0,1,"many footprints (human) leading to buffer, though only a few within, as granite bedrock provides a resistant surface.",Yes,Yes,"Woody <2m, Forb, Grass, Bryophyte","Woody <2m: 0824, 0825, 0821, 0822, 0823
Forb: 0819, 0820
Grass: 0817, 0818
Bryophyte: 0826",NA,NA,1,3,2,NA,NA,NA,NA,4,NA,No,2 native species of bunchgrass also present,Yes,<Null>,BRRU2 (Bromus rubens),"BRRU2 (Bromus rubens): 0817, 0818",12/19/2019 17:24,mojn_hydro,3/10/2022 21:26,mlehman@nps.gov_nps,<Null>,<Null>,<Null>,<Null>,<Null>,<Null>,<Null>,<Null>,<Null>,<Null>,<Null>,<Null>,<Null>,<Null>,Point
39,{d79a9eb7-0d9c-4e36-b19c-474404c0896e},Joshua Tree NP,JOTR_P_BLA0045,JOTR_P_BLA0045,102,12/18/2019 16:20,MOJN DS (Published 2018),JOTR_P_BLA0045: 2019-12-18,Primary,Sampled,Rheocrene,"No evidence of spring or recently flowing water, vegetation at source is same baccharis growing throughout wash; site sampled due to long, flowing springbrook observed during the December 2005 inventory visit, spring may or may not be permanently dry",Zone 11,NAD83 (Unknown),MOJN G1 (Garmin64),No,36782,MOJN_02,No,<Null>,<Null>,<Null>,<Null>,<Null>,<Null>,dry,Estimated,,0 L/s,<Null>,<Null>,No evidence of recent water at the surface,,Measured,0,0,<Null>,<Null>,Sandy wash / trail in gentle canyon,No - Insufficient water,12/17/2019 16:15,<Null>,<Null>,<Null>,<Null>,<Null>,<Null>,<Null>,<Null>,<Null>,<Null>,<Null>,<Null>,<Null>,<Null>,<Null>,<Null>,<Null>,<Null>,<Null>,<Null>,<Null>,<Null>,<Null>,<Null>,<Null>,<Null>,<Null>,<Null>,<Null>,<Null>,<Null>,<Null>,<Null>,<Null>,<Null>,<Null>,<Null>,<Null>,None,0,0,0,4,0,0,0,0,0,0,4,"Black Rock Trail runs directly up the wash that the spring brook emerges in and flows down, popular trail beginning from Black Rock Campground, hikers seen at spring along with many boot prints in wash",Yes,Yes,"Woody <2m, Grass","Woody <2m: 0919, 0920
Grass0917, 0918",NA,NA,1,NA,2,NA,NA,NA,NA,NA,NA,No,"Junipers, pines, oaks, and yuccas outside buffer on canyon flanks; rabbit rush also in buffer",Yes,<Null>,"BRRU2 (Bromus rubens), BRTE (Bromus tectorum)","BRRU2 (Bromus rubens)0917, 0918
BRTE (Bromus tectorum): 0921, 0922",12/19/2019 1:58,mojn_hydro,3/10/2022 21:26,mlehman@nps.gov_nps,<Null>,<Null>,<Null>,<Null>,<Null>,<Null>,<Null>,<Null>,<Null>,<Null>,<Null>,<Null>,<Null>,<Null>,Point
42,{8f767083-d0ef-461d-9fcc-b94c11748752},Joshua Tree NP,JOTR_P_SPA0074,JOTR_P_SPA0074,113,12/18/2019 17:07,MOJN DS (Published 2018),JOTR_P_SPA0074: 2019-12-18,Primary,Sampled,Rheocrene,"source is completely dry, in a dry wash, though sudden increase in baccharis density marks spring",Zone 11,NAD83 (Unknown),MOJN G4 (Garmin64),No,36783,MOJN_03,No,<Null>,,<Null>,<Null>,<Null>,<Null>,dry,Estimated,,0 L/s,<Null>,<Null>,"source dry, though there are filled ""traps"" and ""tanks"" ~50-100m downstream, filled with recent rains",,Measured,0,0,<Null>,<Null>,"channel is a shallow incision (~20cm) meandering down a slight decline. filled with loose granitic sediement (sand/gravel), highly immature.",No - Insufficient water,<Null>,<Null>,<Null>,<Null>,<Null>,<Null>,,<Null>,<Null>,<Null>,<Null>,<Null>,<Null>,<Null>,<Null>,<Null>,<Null>,<Null>,<Null>,<Null>,<Null>,<Null>,<Null>,<Null>,<Null>,<Null>,<Null>,<Null>,<Null>,<Null>,<Null>,<Null>,<Null>,<Null>,<Null>,<Null>,<Null>,<Null>,<Null>,None,0,0,0,0,0,0,0,0,1,0,1,"dense packed footprints in loose sand, likely a game trail, though prints indistinguishable. baccharis is heavily browsed along game trail/wash",Yes,Yes,"Woody >4m, Woody 2-4m, Woody <2m, Forb, Grass, Bryophyte, Non-Plant","Woody >4m: 0844, 0846
Woody 2-4m: 0847, 0848, 0849
Woody <2m: 0831, 0832, 0833, 0843
Forb: 0840, 0841, 0842
Grass: 0838, 0839
Bryophyte: 0837
Non-Plant: 0834",5,3,1,2,3,NA,NA,NA,NA,7,6,No,<Null>,Yes,<Null>,BRRU2 (Bromus rubens),"BRRU2 (Bromus rubens): 0835, 0836",12/19/2019 17:05,mojn_hydro,3/10/2022 21:26,mlehman@nps.gov_nps,No Data,,<Null>,<Null>,<Null>,<Null>,<Null>,<Null>,<Null>,<Null>,<Null>,<Null>,,<Null>,Point
41,{615db332-7c11-4b79-aa2f-a971496090f1},Joshua Tree NP,JOTR_P_CLO0250,JOTR_P_CLO0250,97,12/18/2019 18:03,MOJN DS (Published 2018),JOTR_P_CLO0250: 2019-12-18,Primary,Sampled,Rheocrene,"spring source completely dry in a dry wash with no signs of recent flow. wash flows through an open meadow filled with annual forbs, grasses, and sedge.",Zone 11,NAD83 (Unknown),MOJN G4 (Garmin64),No,36783,MOJN_03,No,<Null>,<Null>,<Null>,<Null>,<Null>,<Null>,dry,Estimated,,0 L/s,<Null>,<Null>,no discharge. dry.,,Measured,0,0,<Null>,<Null>,"dry, immature gravel (granitic) sed-filled channel meanders through a flat meadow filled with sedges, grasses, and forbs.",No - Insufficient water,<Null>,<Null>,<Null>,<Null>,<Null>,<Null>,<Null>,<Null>,<Null>,<Null>,<Null>,<Null>,<Null>,<Null>,<Null>,<Null>,<Null>,<Null>,<Null>,<Null>,<Null>,<Null>,<Null>,<Null>,<Null>,<Null>,<Null>,<Null>,<Null>,<Null>,<Null>,<Null>,<Null>,<Null>,<Null>,<Null>,<Null>,<Null>,<Null>,None,0,1,0,0,0,0,0,0,0,0,1,"a single path of human and dog tracks lead down the buffer, otherwise an untouched spring.",Yes,Yes,"Woody >4m, Woody <2m, Forb, Grass","Woody >4m: 0873, 0874, 0875
Woody <2m: 0865, 0866, 0868
Forb: 0859, 0860, 0861
Grass: 0862, 0863, 0864",2,NA,3,1,4,NA,NA,NA,NA,NA,NA,No,"mistletoe just outside the buffer on catclaw (~10m). Great annual forb diversity, at least 10 different species",Yes,thistle may also be native. 2 individuals.,"UNK (_unknown species), BRRU2 (Bromus rubens), BRTE (Bromus tectorum)","UNK (_unknown species): 0869, 0870, 0871, 0872
BRRU2 (Bromus rubens): 0854, 0855
BRTE (Bromus tectorum): 0856, 0858",12/19/2019 16:50,mojn_hydro,3/10/2022 21:26,mlehman@nps.gov_nps,<Null>,<Null>,<Null>,<Null>,<Null>,<Null>,<Null>,<Null>,<Null>,<Null>,<Null>,<Null>,<Null>,<Null>,Point
49,{cd933d8c-1a57-4af4-a763-dd26323749bc},Joshua Tree NP,JOTR_P_STU0142,JOTR_P_STU0142,90,1/7/2020 22:40,MOJN DS (Published 2018),JOTR_P_STU0142: 2020-01-07,Primary,Sampled,Hillslope,"Spring is helocrene as well as hillslope. Source is small clearing in sedges with gravel and sand substrate, with source possibly originating in small channel above source pool; recent heavy snow (~1 week ago), small snow patches remain.",Zone 11,NAD83 (Unknown),MOJN G3 (Garmin64),No,36782,MOJN_02,No,<Null>,<Null>,<Null>,<Null>,<Null>,<Null>,standing water,Estimated,,<0.1 L/s,<Null>,<Null>,"standing water only; 5-6 small puddles (<\= 10cm wide), and wet soil with film of water.",,Measured,1,1,<Null>,<Null>,"sedge and baccharis spp. filled channel; small channel (~1.5m) above source w/ signs of scouring; rest of channel w/ matting of vegetation and little scouring or deposition. Additional notes: Plastic pipes on trail leading to spring, >100m from spring. Round cemented boulder retention basin, empty, in wash below hillslope, ~35m downstream of where spring channel enters wash.",Yes,1/7/2020 22:40,MOJN YSI ProDSS (1790),MOJN YSI ProDSS (1790),MOJN YSI ProDSS (1790),MOJN YSI ProDSS (1790),MOJN YSI ProDSS (1790),No,calibrated at this spring,<Null>,<Null>,<Null>,<Null>,<Null>,<Null>,<Null>,<Null>,<Null>,<Null>,<Null>,<Null>,<Null>,"pH,DO_percent,DO_mg_per_L,SpCond,Temp",<Null>,7.7,7.7,7.69,6.6,6.6,6.6,817,816,816,74.8,7.8,74.7,7.8,74.7,7.8,"very shallow puddle, but all sensors submerged",None,0,0,0,0,0,0,0,0,3,0,3,"Flattened veg. probably from wildlife use (wildlife trail), but could also be from recent snowfall; only location of water, near game camera",Yes,Yes,"Woody <2m, Forb, Sedge, Cattail, Bryophyte","Woody <2m: 0724, 0723
Forb: 0727, 0726, 0725
Sedge: 0735, 0734
Cattail: 0729, 0728
Bryophyte: 0733",NA,NA,2,3,NA,NA,NA,1,4,5,NA,No,"mistletoe is present outside of buffer. Sedge note: Shoenoplectus americanus nearly co-dominant with the unknown sedge (pics 0731, 0730).",Yes,BRRU2 near wildlife camera,BRRU2 (Bromus rubens),"BRRU2 (Bromus rubens): 0738, 0739",1/9/2020 21:28,mojn_hydro,3/10/2022 21:26,mlehman@nps.gov_nps,<Null>,<Null>,<Null>,<Null>,<Null>,<Null>,<Null>,<Null>,NF,NF,NF,NF,<Null>,<Null>,Point
50,{a9c92bfe-6ef0-4684-8a1a-059b94bdc04e},Joshua Tree NP,JOTR_P_PEA0019,JOTR_P_PEA0019,106,1/8/2020 16:12,MOJN DS (Published 2018),JOTR_P_PEA0019: 2020-01-08,Primary,Sampled,Rheocrene,"Thick vegetation in canyon wash, small 5cm x 5cm pool located under large willow tree, with damp soil; ~20m upstream film of water found on bedrock in middle of wash.",Zone 11,NAD83 (Unknown),MOJN G3 (Garmin64),No,36782,MOJN_02,No,<Null>,<Null>,<Null>,<Null>,<Null>,<Null>,standing water,Estimated,,<0.1 L/s,<Null>,<Null>,"Small 5cm x 5cm pool, 1-2cm deep around roots under large willow.",,Measured,0.05,0.05,<Null>,<Null>,"from under willow trees, channel becomes very slightly incised into sandy wash (for about 5m); then becomes broader sandy wash choked with willow (unknown spp.) baccharis spp., and bunchgrass.",No - Insufficient water,<Null>,<Null>,<Null>,<Null>,<Null>,<Null>,<Null>,<Null>,<Null>,<Null>,<Null>,<Null>,<Null>,<Null>,<Null>,<Null>,<Null>,<Null>,<Null>,<Null>,<Null>,<Null>,<Null>,<Null>,<Null>,<Null>,<Null>,<Null>,<Null>,<Null>,<Null>,<Null>,<Null>,<Null>,<Null>,<Null>,<Null>,<Null>,too shallow to properly submerge sensor,None,0,0,0,0,0,0,0,0,0,0,0,-,Yes,Yes,"Woody >4m, Woody 2-4m, Woody <2m, Forb, Grass, Cattail","Woody >4m: 0761, 0762, 0763, 0764
Woody 2-4m: 0751, 0752, 0753
Woody <2m: 0759, 0760
Forb: 0748, 0750
Grass: 0765, 0766
Cattail: 0767, 0768",4,1,2,6,3,NA,NA,NA,5,NA,NA,No,"mistletoe outside of buffer. an unknown, possibly invasive forb; pics 0754, 0755, 0756",Yes,BRRU2 scattered in buffer. ERCI6 just outside buffer.,"BRRU2 (Bromus rubens), ERCI6 (Erodium cicutarium)","BRRU2 (Bromus rubens): 0757, 0758
ERCI6 (Erodium cicutarium): 0772, 0771",1/9/2020 21:52,mojn_hydro,3/10/2022 21:26,mlehman@nps.gov_nps,<Null>,<Null>,<Null>,<Null>,<Null>,<Null>,<Null>,<Null>,<Null>,<Null>,<Null>,<Null>,<Null>,<Null>,Point
51,{83bbb311-1d2b-4ed8-9f4d-02c225e7f293},Joshua Tree NP,JOTR_P_FAN0259,JOTR_P_FAN0259,93,1/8/2020 17:55,MOJN DS (Published 2018),JOTR_P_FAN0259: 2020-01-08,Primary,Sampled,Rheocrene,"Spring source in dry wash, lined primarily with Baccharis. ~100m downstream the wash is damp and has living moss on the west bank.",Zone 11,NAD83 (Unknown),MOJN G3 (Garmin64),No,36782,MOJN_02,No,<Null>,<Null>,<Null>,<Null>,<Null>,<Null>,dry,Estimated,,0 L/s,<Null>,<Null>,dry. wet sandy channel and banks ~100m downstream.,,Measured,0,0,<Null>,<Null>,"sandy channel wih boulders, cobbles, and pebbles. 3-4m wide. Sand incised ~3cm deep and 0.5m wide.",No - Insufficient water,<Null>,<Null>,<Null>,<Null>,<Null>,<Null>,<Null>,<Null>,<Null>,<Null>,<Null>,<Null>,<Null>,<Null>,<Null>,<Null>,<Null>,<Null>,<Null>,<Null>,<Null>,<Null>,<Null>,<Null>,<Null>,<Null>,<Null>,<Null>,<Null>,<Null>,<Null>,<Null>,<Null>,<Null>,<Null>,<Null>,<Null>,<Null>,-,None,0,0,0,0,0,0,0,0,0,0,0,-,Yes,Yes,"Woody <2m, Forb, Grass, Bryophyte","Woody <2m: 0779, 0780
Forb: 0781, 0782
Grass: 0783, 0784
Bryophyte: 0785",NA,NA,1,3,2,NA,NA,NA,NA,4,NA,No,"Juniperus spp., yucca, and antelope bitterbrush also present in buffer; brome and rabbitsfoot almost codominant with bunchgrass.",Yes,BRRU2 and POMO5 throughout buffer,"POMO5 (Polypogon monspeliensis), BRRU2 (Bromus rubens)","POMO5 (Polypogon monspeliensis): 0777, 0778
BRRU2 (Bromus rubens): 0776",1/9/2020 22:10,mojn_hydro,3/10/2022 21:26,mlehman@nps.gov_nps,<Null>,<Null>,<Null>,<Null>,<Null>,<Null>,<Null>,<Null>,<Null>,<Null>,<Null>,<Null>,<Null>,<Null>,Point
52,{ec68e45f-20ae-4cf1-af69-b9732531b92d},Joshua Tree NP,JOTR_P_TUN0233,JOTR_P_TUN0233,95,1/8/2020 23:34,MOJN DS (Published 2018),JOTR_P_TUN0233: 2020-01-08,Primary,Sampled,Rheocrene,"Dry; soil damp under ""source rock"" with green grass, may be due to recent heavy snow; pipes and acheological remains abundant in canyon. Additional notes: standing water in shallow pools ~80-100m downstream of source, possibly from snowmelt?",Zone 11,NAD83 (Unknown),MOJN G3 (Garmin64),No,36782,MOJN_02,No,<Null>,<Null>,<Null>,<Null>,<Null>,<Null>,dry,Estimated,,0 L/s,<Null>,<Null>,"dry; damp soil, but probably from precip.; located @ 5m from source is the damp soil.",,Measured,0,0,<Null>,<Null>,"Sandy wash with occasional bedrock, Bromus rubens carpers much of wash; no/little incision.",No - Insufficient water,<Null>,<Null>,<Null>,<Null>,<Null>,<Null>,<Null>,<Null>,<Null>,<Null>,<Null>,<Null>,<Null>,<Null>,<Null>,<Null>,<Null>,<Null>,<Null>,<Null>,<Null>,<Null>,<Null>,<Null>,<Null>,<Null>,<Null>,<Null>,<Null>,<Null>,<Null>,<Null>,<Null>,<Null>,<Null>,<Null>,<Null>,<Null>,-,Yes - All inactive,0,1,1,0,0,0,0,0,0,0,1,"Not a hiking trail, but footprints present, archeological ruins present (building footprint, walls, pipes, metal), some trash (glass) and old evidence of campfire.",Yes,Yes,"Woody <2m, Forb, Grass, Bryophyte, Non-Plant","Woody <2m: 0796, 0795, 0791
Forb: 0801, 0802
Grass: 0790, 0789
Bryophyte: 0797
Non-Plant: 0800, 0799",NA,NA,2,3,1,NA,NA,NA,NA,5,4,No,BRRU2 carpets buffer heavily,Yes,B. rubens thick in buffer,BRRU2 (Bromus rubens),"BRRU2 (Bromus rubens): 0790, 0789",1/9/2020 22:25,mojn_hydro,3/10/2022 21:26,mlehman@nps.gov_nps,<Null>,<Null>,<Null>,<Null>,<Null>,<Null>,<Null>,<Null>,<Null>,<Null>,<Null>,<Null>,<Null>,<Null>,Point
53,{9e6fe453-5ade-4bf3-be4d-fb56a9375f59},Joshua Tree NP,JOTR_P_GIB0086,JOTR_P_GIB0086,79,1/9/2020 0:33,MOJN DS (Published 2018),JOTR_P_GIB0086: 2020-01-08,Primary,Sampled,Rheocrene,dry; springbrook in incised bedrock channel; vegetation sparse.,Zone 11,NAD83 (Unknown),MOJN G3 (Garmin64),No,36782,MOJN_02,Yes,Yes,Yes,HOBO TidbiT,349,16:33,new sensor deployed on same white wire,dry,Estimated,,0 L/s,<Null>,<Null>,dry,,Measured,0,0,<Null>,<Null>,"channel in bedrock fault, some sand, gravel, cobble deposition; channel bottom is damp, likely due to snowmelt as source is dry.",No - Insufficient water,<Null>,<Null>,<Null>,<Null>,<Null>,<Null>,<Null>,<Null>,<Null>,<Null>,<Null>,<Null>,<Null>,<Null>,<Null>,<Null>,<Null>,<Null>,<Null>,<Null>,<Null>,<Null>,<Null>,<Null>,<Null>,<Null>,<Null>,<Null>,<Null>,<Null>,<Null>,<Null>,<Null>,<Null>,<Null>,<Null>,<Null>,<Null>,-,None,0,1,0,0,0,0,0,0,0,0,1,"footprints in neighboring wash; minor trash in buffer (glass, plastic), hiking trail above wash is outside buffer",Yes,Yes,"Woody <2m, Forb, Grass, Bryophyte, Non-Plant","Woody <2m: 0813, 0812
Forb: 0822, 0823
Grass: 0810, 0806, 0805
Bryophyte: 0814
Non-Plant: 0815",NA,NA,1,3,2,NA,NA,NA,NA,4,5,No,"sparse veg, Baccharis are short, other woody<2 (unknown) present; other green grass (0824, 0825) close to codominant with B. rubens",Yes,ERCI6 in sandy area below wash,"BRRU2 (Bromus rubens), ERCI6 (Erodium cicutarium)","BRRU2 (Bromus rubens): 0810, 0806, 0805
ERCI6 (Erodium cicutarium): 0804, 0803",1/9/2020 22:41,mojn_hydro,3/10/2022 21:26,mlehman@nps.gov_nps,<Null>,<Null>,<Null>,<Null>,<Null>,<Null>,<Null>,<Null>,<Null>,<Null>,<Null>,<Null>,<Null>,<Null>,Point
174,{6d434c27-4de7-4901-b250-a918bc3835d6},Joshua Tree NP,JOTR_P_CON0215,JOTR_P_CON0215,76,1/13/2020 22:53,MOJN DS (Published 2018),JOTR_P_CON0215: 2020-01-13,Replicate,Sampled,Rheocrene,"There is water at the spring, with the source pool being ~30x10 cm and a spring brook length of ~1.5 m. There are mosquito larvae in the source pool. Visit here was to deploy another sensor.",Zone 12,NAD83 (Unknown),BadElf 4181,No,36781,MOJN_05,Yes,No,Yes,HOBO TidbiT,348,14:50,Bolt hammered in between two boulders. Sensor attached with red and white wire.,standing water,Estimated,,<0.1 L/s,<Null>,<Null>,<Null>,,Measured,1.5,0.1,<Null>,<Null>,<Null>,No - Other reason,<Null>,<Null>,<Null>,<Null>,<Null>,<Null>,,<Null>,<Null>,<Null>,<Null>,<Null>,<Null>,<Null>,<Null>,<Null>,<Null>,<Null>,<Null>,<Null>,<Null>,<Null>,<Null>,<Null>,<Null>,<Null>,<Null>,<Null>,<Null>,<Null>,<Null>,<Null>,<Null>,<Null>,<Null>,<Null>,<Null>,<Null>,<Null>,No Data,NoData,NoData,NoData,NoData,NoData,NoData,NoData,NoData,NoData,NoData,NoData,<Null>,No Data,No Data,<Null>,<Null>,<Null>,<Null>,<Null>,<Null>,<Null>,<Null>,<Null>,<Null>,<Null>,<Null>,<Null>,No Data,<Null>,No Data,<Null>,<Null>,<Null>,10/4/2021 16:00,mojn_hydro,3/10/2022 21:26,mlehman@nps.gov_nps,No Data,,<Null>,<Null>,<Null>,<Null>,<Null>,<Null>,<Null>,<Null>,<Null>,<Null>,<Null>,<Null>,Point
55,{fb00f59d-281e-4c65-adaa-2c8e594d3d4f},Joshua Tree NP,JOTR_P_MEE0191,JOTR_P_MEE0191,104,1/14/2020 20:07,MOJN DS (Published 2018),JOTR_P_MEE0191: 2020-01-14,Primary,Sampled,Rheocrene,"Spring has damp soil from seep along exposed bedrock amidst a dry wash with otherwise no signs of a spring, except for single honey mesquite 20 m downstream of source. However, a few bees were found lapping at the moisture along with a baby toad, indicating some persistence of moisture/water. Fresh sheep scat found just outside of buffer (downstream).",Zone 11,NAD83 (Unknown),BadElf 4181,No,36781,MOJN_05,No,<Null>,,<Null>,<Null>,<Null>,<Null>,wet soil only,Estimated,,<0.1 L/s,<Null>,<Null>,Discharge occurs as a seep beneath the loose wash sediment at the base of exposed bedrock. Wet soil crosses the wash laterally along the base of the bedrock/dryfall.,,Measured,0,0,<Null>,<Null>,Source emerges at the base of an exposed micaceous (muscovite primarily) schist/gneiss. The channel continues as a dry wash choked with granitic boulders with loose interstitial cobbles and gravel.,No - Insufficient water,<Null>,<Null>,<Null>,<Null>,<Null>,<Null>,,<Null>,<Null>,<Null>,<Null>,<Null>,<Null>,<Null>,<Null>,<Null>,<Null>,<Null>,<Null>,<Null>,<Null>,<Null>,<Null>,<Null>,<Null>,<Null>,<Null>,<Null>,<Null>,<Null>,<Null>,<Null>,<Null>,<Null>,<Null>,<Null>,<Null>,<Null>,<Null>,None,0,0,0,0,0,0,0,1,0,0,1,No evidence of any disturbance in buffer or through most of the wash leading to the spring. Pristine spring other than some flattened shrubs from flooding.,Yes,Yes,"Woody 2-4m, Woody <2m, Forb, Grass, Bryophyte, Non-Plant","Woody 2-4m: 0365, 0366
Woody <2m: 0360, 0361
Forb: 0362, 0363
Grass: 0367, 0368
Bryophyte: 0371
Non-Plant: 0370",NA,2,1,3,5,NA,NA,NA,NA,4,6,Yes,Lycia sp. also present within buffer.,Yes,<Null>,BRRU2 (Bromus rubens),BRRU2 (Bromus rubens): 0369,1/16/2020 1:59,lcombs@nps.gov_nps,3/10/2022 21:26,mlehman@nps.gov_nps,<Null>,<Null>,<Null>,<Null>,<Null>,<Null>,<Null>,<Null>,<Null>,<Null>,<Null>,<Null>,<Null>,<Null>,Point
54,{317e2a9f-e7f7-4085-a128-c95e8c14ac5a},Joshua Tree NP,JOTR_P_DIK0132,JOTR_P_DIK0132,92,1/15/2020 17:28,MOJN DS (Published 2018),JOTR_P_DIK0132: 2020-01-15,Primary,Sampled,Rheocrene,"Source pool filled in with sand and gravel from recent flooding, but still flowing out of downstream area of source pool where water emerges from saturated sand and over mossy root escarpment. Downstream spring brook filled with sand that partly buries shed palm fronds. ",Zone 11,NAD83 (Unknown),BadElf 4181,No,36781,MOJN_05,No,<Null>,,<Null>,<Null>,<Null>,<Null>,flowing,Estimated,,<0.1 L/s,<Null>,<Null>,"Discharge seeps from a small fracture in granite bedrock directly upstream of source pool, before flowing saturating loose sand for 3m, and re-emerging out of sand to flow over a palm root escarpment, about 1m wide for 2.9 m. ",,Measured,2.9,1,<Null>,<Null>,"Channel flows through fan palm oasis, littered with palm fronds, filled with sand and gravel and old root mounds. 7 m downstream is old stone structure, probably a trough. ",No - Insufficient water,<Null>,<Null>,<Null>,<Null>,<Null>,<Null>,,<Null>,<Null>,<Null>,<Null>,<Null>,<Null>,<Null>,<Null>,<Null>,<Null>,<Null>,<Null>,<Null>,<Null>,<Null>,<Null>,<Null>,<Null>,<Null>,<Null>,<Null>,<Null>,<Null>,<Null>,<Null>,<Null>,<Null>,<Null>,<Null>,<Null>,<Null>,Water present is only a few mm deep.,Yes - All inactive,0,2,0,0,0,0,0,3,0,0,3,"Flooding has filled source pool and channel with sand, burying vegetation. Human use attributed to boot prints, trough, pipe, and trampling of vegetation.",Yes,Yes,"Woody >4m, Woody 2-4m, Bryophyte, Non-Plant, Woody <2m, Grass","Woody >4m: 0377, 0378
Woody 2-4m: 0379, 0380
Bryophyte: 0382
Non-Plant: 0383, 0384
Woody <2m: 0385, 0386
